-- phpMyAdmin SQL Dump
-- version 5.2.1
-- https://www.phpmyadmin.net/
--
-- Hôte : 127.0.0.1
-- Généré le : lun. 17 nov. 2025 à 21:47
-- Version du serveur : 10.4.32-MariaDB
-- Version de PHP : 8.0.30

SET SQL_MODE = "NO_AUTO_VALUE_ON_ZERO";
START TRANSACTION;
SET time_zone = "+00:00";


/*!40101 SET @OLD_CHARACTER_SET_CLIENT=@@CHARACTER_SET_CLIENT */;
/*!40101 SET @OLD_CHARACTER_SET_RESULTS=@@CHARACTER_SET_RESULTS */;
/*!40101 SET @OLD_COLLATION_CONNECTION=@@COLLATION_CONNECTION */;
/*!40101 SET NAMES utf8mb4 */;

--
-- Base de données : `hospital_db_star2`
--

DELIMITER $$
--
-- Procédures
--
CREATE DEFINER=`root`@`localhost` PROCEDURE `sp_get_patient_medical_record` (IN `p_patient_id` VARCHAR(36))   BEGIN
    -- Informations du patient
    SELECT * FROM patients WHERE id = p_patient_id;
    
    -- Allergies
    SELECT * FROM allergies WHERE patient_id = p_patient_id ORDER BY start_date DESC;
    
    -- Conditions
    SELECT * FROM conditions WHERE patient_id = p_patient_id ORDER BY start_date DESC;
    
    -- Consultations
    SELECT * FROM encounters WHERE patient_id = p_patient_id ORDER BY start_datetime DESC LIMIT 10;
    
    -- Médicaments actifs
    SELECT * FROM medications WHERE patient_id = p_patient_id AND stop_datetime IS NULL;
    
    -- Vaccinations
    SELECT * FROM immunizations WHERE patient_id = p_patient_id ORDER BY date_administered DESC;
END$$

CREATE DEFINER=`root`@`localhost` PROCEDURE `sp_validate_staging_data` ()   BEGIN
    DECLARE affected_rows INT;

    -- --- DÉMARRAGE ---
    INSERT INTO staging_validation_log(table_name, message)
    VALUES ('SYSTEM', '--- DÉMARRAGE DE LA VALIDATION ---');

    /* ==============================
       1. VALIDATION STAGING_PATIENTS
       ============================== */

    -- 1.1 Champs obligatoires manquants
    UPDATE staging_patients
    SET extraction_status = 'error',
        error_message = 'ID ou nom manquant'
    WHERE (id IS NULL OR id = '' OR first_name IS NULL OR first_name = '')
      AND extraction_status = 'pending';
    SET affected_rows = ROW_COUNT();
    INSERT INTO staging_validation_log(table_name, message)
    VALUES ('PATIENTS', CONCAT(affected_rows, ' erreurs : ID/nom manquant.'));

    -- 1.2 Doublons sur id
    UPDATE staging_patients p
    JOIN (
        SELECT id
        FROM staging_patients
        WHERE extraction_status = 'pending'
        GROUP BY id
        HAVING COUNT(*) > 1
    ) d ON d.id = p.id
    SET p.extraction_status = 'error',
        p.error_message = 'Doublon patient_id'
    WHERE p.extraction_status = 'pending';
    SET affected_rows = ROW_COUNT();
    INSERT INTO staging_validation_log(table_name, message)
    VALUES ('PATIENTS', CONCAT(affected_rows, ' erreurs : doublons id.'));

    /* ==============================
       2. VALIDATION STAGING_ENCOUNTERS
       ============================== */

    -- Champs manquants
    UPDATE staging_encounters
    SET extraction_status = 'error',
        error_message = 'ID ou start_datetime manquant'
    WHERE (id IS NULL OR id = '' OR start_datetime IS NULL OR start_datetime = '')
      AND extraction_status = 'pending';
    SET affected_rows = ROW_COUNT();
    INSERT INTO staging_validation_log(table_name, message)
    VALUES ('ENCOUNTERS', CONCAT(affected_rows, ' erreurs : ID/date manquants.'));

    -- FK patient
    UPDATE staging_encounters e
    LEFT JOIN staging_patients p ON e.patient_id = p.id
    SET e.extraction_status = 'error',
        e.error_message = 'patient_id introuvable dans staging_patients'
    WHERE p.id IS NULL
      AND e.extraction_status = 'pending';
    SET affected_rows = ROW_COUNT();
    INSERT INTO staging_validation_log(table_name, message)
    VALUES ('ENCOUNTERS', CONCAT(affected_rows, ' erreurs : patient_id orphelin.'));

    /* ==============================
       3. VALIDATION TABLES ANNEXES
       ============================== */

    -- Exemple pour CONDITIONS (idem pour autres tables)
    UPDATE staging_conditions c
    LEFT JOIN staging_encounters e ON c.encounter_id = e.id
    SET c.extraction_status = 'error',
        c.error_message = 'encounter_id introuvable'
    WHERE e.id IS NULL
      AND c.extraction_status = 'pending';
    SET affected_rows = ROW_COUNT();
    INSERT INTO staging_validation_log(table_name, message)
    VALUES ('CONDITIONS', CONCAT(affected_rows, ' erreurs encounter_id orphelin.'));

    -- Répéter pour MEDICATIONS, PROCEDURES, OBSERVATIONS, ALLERGIES, IMMUNIZATIONS
    -- en remplaçant table_name et c/m/pr/o/a/i selon la table

    INSERT INTO staging_validation_log(table_name, message)
    VALUES ('SYSTEM', '--- VALIDATION TERMINÉE ---');
END$$

DELIMITER ;

-- --------------------------------------------------------

--
-- Structure de la table `dim_allergy`
--

CREATE TABLE `dim_allergy` (
  `allergy_id` int(11) NOT NULL,
  `encounter_id` varchar(36) DEFAULT NULL,
  `patient_id` int(11) DEFAULT NULL,
  `code` varchar(50) DEFAULT NULL,
  `description` text DEFAULT NULL,
  `start_date` date DEFAULT NULL,
  `stop_date` date DEFAULT NULL
) ENGINE=InnoDB DEFAULT CHARSET=utf8mb4 COLLATE=utf8mb4_general_ci;

--
-- Déchargement des données de la table `dim_allergy`
--

INSERT INTO `dim_allergy` (`allergy_id`, `encounter_id`, `patient_id`, `code`, `description`, `start_date`, `stop_date`) VALUES
(1, '390906007', 3, 'null', 'Influenza', '2022-08-10', NULL),
(2, '390906007', 3, 'null', 'Aucune allergie connue', NULL, NULL),
(3, '390906007', 4, '', 'Aucune allergie connue', NULL, NULL),
(4, '390906007', 3, NULL, 'Influenza', '2022-08-10', NULL),
(5, '390906007', 3, NULL, 'Aucune allergie connue', NULL, NULL),
(6, '390906007', 4, NULL, 'Vaccin contre la grippe', '2024-11-10', NULL),
(7, '390906007', 4, NULL, 'Vaccin COVID-19 (rappel)', '2024-07-10', NULL),
(8, '390906007', 5, 'Aucune allergie connue', 'Aucune allergie connue', NULL, NULL),
(9, '390906007', 6, 'Peanuts', 'Allergie aux arachides', '2017-11-10', NULL),
(10, 'RÉSUMÉ DES CONSULTATIONS', 8, NULL, 'Aucune allergie connue', NULL, NULL),
(11, '390906007', 9, NULL, 'Aucune allergie connue', '1990-03-26', NULL),
(12, '390906007', 12, 'Sulfa drugs', 'Allergie aux médicaments sulfonamidés', '2017-11-10', NULL),
(13, '390906007', 12, 'Latex', 'Allergie au latex', '2013-11-10', NULL),
(14, '390906007', 17, NULL, 'Vaccin contre la grippe', '2024-11-10', NULL),
(15, '390906007', 17, NULL, 'Vaccin COVID-19 (rappel)', '2024-07-10', NULL),
(16, '390906007', 17, NULL, 'Vaccin tétanos (rappel)', '2020-11-10', NULL),
(17, '390906007', 22, NULL, 'Influenza', '2021-05-10', NULL),
(18, '390906007', 22, NULL, 'Pneumococcal (elderly)', '2024-07-10', NULL),
(19, '390906007', 26, NULL, 'Aucune allergie connue', '2020-10-10', '9999-12-31'),
(20, '390906007', 28, 'Aucune allergie connue', 'Aucune allergie connue', NULL, NULL),
(21, 'RÉSUMÉ DES CONSULTATIONS', 29, 'Latex', 'Allergie à la latex', '2017-11-10', NULL),
(22, 'RÉSUMÉ DES CONSULTATIONS', 29, 'Shellfish', 'Allergie aux coquillages', '2016-11-10', NULL),
(23, '390906007', 30, 'N/A', 'Aucune allergie connue', NULL, NULL),
(24, '390906007', 32, 'Aucune allergie connue', 'Aucune allergie connue', NULL, NULL),
(25, '390906007', 33, NULL, 'Aucune allergie connue', NULL, NULL),
(26, 'Visite le 10 mai 2025 à Inconnu', 35, 'Aucune allergie connue', 'Aucune allergie connue', NULL, NULL),
(27, '01f0378a-80a5-4dd3-8094-afa971205da1', 36, NULL, 'Amlodipine 5 mg', '2022-12-21', NULL),
(28, '01f0378a-80a5-4dd3-8094-afa971205da1', 36, NULL, 'Vaccin contre la grippe', '2024-11-10', NULL),
(29, '01f0378a-80a5-4dd3-8094-afa971205da1', 36, NULL, 'Vaccin COVID-19 (rappel)', '2024-07-10', NULL),
(30, '01f0378a-80a5-4dd3-8094-afa971205da1', 36, NULL, 'Vaccin tétanos (rappel)', '2024-11-10', NULL),
(31, '01f0378a-80a5-4dd3-8094-afa971205da1', 36, NULL, 'Blood pressure measurement', '2024-12-10', NULL),
(32, '01f0378a-80a5-4dd3-8094-afa971205da1', 36, NULL, 'Blood pressure: 119/89 mmHg', '2025-02-10', NULL),
(33, '01f0378a-80a5-4dd3-8094-afa971205da1', 36, NULL, 'Heart rate: 116 bpm', '2025-02-10', NULL),
(34, '01f0378a-80a5-4dd3-8094-afa971205da1', 36, NULL, 'Body temperature: 37.1 C', '2025-02-10', NULL),
(35, '01f0378a-80a5-4dd3-8094-afa971205da1', 36, NULL, 'Blood pressure: 93/71 mmHg', '2025-11-10', NULL),
(36, '01f0378a-80a5-4dd3-8094-afa971205da1', 36, NULL, 'Heart rate: 71 bpm', '2025-11-10', NULL),
(37, '01f0378a-80a5-4dd3-8094-afa971205da1', 36, NULL, 'Body temperature: 36.8 C', '2025-11-10', NULL),
(38, '390906007', 38, 'Aucune allergie connue', 'Aucune allergie connue', NULL, NULL),
(39, '390906007', 42, 'Aucune allergie connue', 'Aucune allergie connue', NULL, NULL),
(40, '390906007', 45, 'Aucune allergie connue', 'Aucune allergie connue', NULL, NULL),
(41, '390906007', 46, 'N/A', 'Amlodipine 5 mg', '2007-04-18', NULL),
(42, '390906007', 46, 'N/A', 'Blood pressure: 97/73 mmHg', '2024-08-10', NULL),
(43, '390906007', 46, 'N/A', 'Heart rate: 115 bpm', '2024-08-10', NULL),
(44, '390906007', 46, 'N/A', 'Body temperature: 37.3 C', '2024-08-10', NULL),
(45, '390906007', 46, 'N/A', 'Total cholesterol: 212 mg/dL', '2024-08-10', NULL),
(46, '390906007', 46, 'N/A', 'Pneumococcal (elderly)', '2025-07-10', NULL),
(47, '390906007', 47, NULL, 'Hypertension', '2022-03-10', NULL),
(48, '390906007', 47, NULL, 'Influenza', '2021-04-10', NULL),
(49, '390906007', 47, NULL, 'Aucune allergie connue', NULL, NULL),
(50, '390906007', 48, 'Aucune allergie connue', 'Aucune allergie connue', NULL, NULL),
(51, '390906007', 49, NULL, 'Aucune allergie connue', NULL, NULL),
(52, '390906007', 50, NULL, 'Aucune allergie connue', NULL, NULL),
(53, '390906007', 51, 'N/A', 'Aucune allergie connue', NULL, NULL),
(54, '390906007', 52, NULL, 'Aucune allergie connue', NULL, NULL),
(55, '390906007', 53, NULL, 'Aucune allergie connue', NULL, NULL),
(56, '390906007', 54, NULL, 'Aucune allergie connue', NULL, NULL),
(57, 'RÉSUMÉ DES CONSULTATIONS', 58, 'Aucune allergie connue', 'Aucune allergie connue', NULL, NULL),
(58, '390906007', 59, NULL, 'Metformin 500 mg', '2024-09-25', NULL),
(59, '390906007', 59, NULL, 'Amlodipine 5 mg', '2019-06-18', NULL),
(60, '390906007', 62, NULL, 'Aucune allergie connue', '1977-05-21', NULL),
(61, 'RÉSUMÉ DES CONSULTATIONS', 63, 'Aucune allergie connue', 'Aucune allergie connue', NULL, NULL),
(62, '390906007', 64, NULL, 'Aucune allergie connue', NULL, NULL),
(63, '390906007', 65, NULL, 'Aucune allergie connue', NULL, NULL),
(64, '390906007', 66, 'N/A', 'Aucune allergie connue', NULL, NULL),
(65, 'RÉSUMÉ DES CONSULTATIONS', 67, 'Dairy', 'Allergie au lait', '2019-11-10', NULL),
(66, 'RÉSUMÉ DES CONSULTATIONS', 67, 'Aspirin', 'Allergie à l\'aspirine', '2021-11-10', NULL),
(67, '390906007', 68, 'N/A', 'Aucune allergie connue', NULL, NULL),
(68, '390906007', 69, NULL, 'Aucune allergie connue', NULL, NULL),
(69, '390906007', 70, NULL, 'Vaccin contre la grippe', '2024-11-10', NULL),
(70, '390906007', 70, NULL, 'Vaccin COVID-19 (rappel)', '2024-07-10', NULL),
(71, '390906007', 70, NULL, 'Vaccin tétanos (rappel)', '2020-11-10', NULL),
(72, '376af3da-1969-4bc6-947f-4b5d2be7b439', 71, 'Aucune allergie connue', 'Aucune allergie connue', NULL, NULL),
(73, '390906007', 75, 'Aucune allergie connue', 'Aucune allergie connue', NULL, NULL),
(74, 'RÉSUMÉ DES CONSULTATIONS', 77, NULL, 'Aucune allergie connue', '2021-05-25', '9999-12-31'),
(75, '390906007', 79, NULL, 'Amlodipine 5 mg', '2020-04-23', '9999-12-31'),
(76, '390906007', 79, NULL, 'Influenza', '2023-06-10', '9999-12-31'),
(77, '390906007', 79, NULL, 'Imagerie du 10 décembre 2023, modalité: 366740001, site: 39607008', '2023-12-10', '9999-12-31'),
(78, '390906007', 79, NULL, 'Hypertension (Diagnostiquée le: 10/04/2020)', '2020-04-10', '9999-12-31'),
(79, '390906007', 80, NULL, 'Vaccin tétanos (rappel)', '2020-11-10', NULL),
(80, '390906007', 80, NULL, 'Vaccin COVID-19 (rappel)', '2024-07-10', NULL),
(81, '390906007', 80, NULL, 'Vaccin contre la grippe', '2024-11-10', NULL),
(82, '390906007', 82, 'Type 2 Diabetes Mellitus', 'Diagnostiquée le: 10/07/2025', '2025-07-10', NULL),
(83, '390906007', 82, 'Hypertension', 'Diagnostiquée le: 10/01/2009', '2009-01-10', NULL),
(84, '390906007', 83, NULL, 'Vaccin tétanos (rappel)', '2020-11-10', NULL),
(85, '390906007', 83, NULL, 'Vaccin COVID-19 (rappel)', '2024-07-10', NULL),
(86, '390906007', 83, NULL, 'Vaccin contre la grippe', '2024-11-10', NULL),
(87, 'fcd411f5-6cf4-46ce-aa34-efabee789c5c', 85, 'Aucune allergie connue', 'Aucune allergie connue', NULL, NULL),
(88, 'Visite le 10 novembre 2025 à Inconnu', 86, NULL, 'Aucune allergie connue', '2025-02-10', NULL),
(89, '390906007', 87, 'Aucune allergie connue', 'Aucune allergie connue', '1972-11-10', '1972-11-10'),
(90, '390906007', 88, 'Hypertension', 'Hypertension', '2020-05-10', NULL),
(91, '390906007', 88, 'Type 2 Diabetes Mellitus', 'Type 2 Diabetes Mellitus', '2024-05-10', NULL),
(92, '390906007', 89, NULL, 'Aucune allergie connue', NULL, NULL),
(93, '390906007', 90, NULL, 'Aucune allergie connue', NULL, NULL),
(94, '390906007', 91, NULL, 'Aucune allergie connue', NULL, NULL),
(95, '390906007', 92, NULL, NULL, NULL, NULL),
(96, 'RÉSUMÉ DES CONSULTATIONS', 93, 'Aucune allergie connue', 'Aucune allergie connue', NULL, NULL),
(97, '390906007', 94, NULL, 'Aucune allergie connue', NULL, NULL),
(98, '390906007', 95, 'Shellfish', 'Allergie au shellfish', '2019-11-10', NULL),
(99, 'ca995412-7cbb-401a-97b1-fb6d3324487b', 97, NULL, 'Vaccin tétanos (rappel)', '2020-11-10', NULL),
(100, 'ca995412-7cbb-401a-97b1-fb6d3324487b', 97, NULL, 'Vaccin COVID-19 (rappel)', '2024-07-10', NULL),
(101, 'ca995412-7cbb-401a-97b1-fb6d3324487b', 97, NULL, 'Vaccin contre la grippe', '2024-11-10', NULL),
(102, 'ca995412-7cbb-401a-97b1-fb6d3324487b', 97, NULL, 'Blood pressure measurement', '2024-12-10', NULL),
(103, '390906007', 98, NULL, 'Aucune allergie connue', NULL, NULL),
(104, '390906007', 99, NULL, 'Aucune allergie connue', NULL, NULL),
(105, '9e6faf9f-38b6-446b-ab88-8825558a5b93', 100, NULL, 'Hypertension', '2021-11-10', NULL),
(106, '9e6faf9f-38b6-446b-ab88-8825558a5b93', 100, NULL, 'Amlodipine 5 mg', '2024-03-10', NULL),
(107, '9e6faf9f-38b6-446b-ab88-8825558a5b93', 100, NULL, 'Ramipril 5 mg', '2024-08-10', NULL),
(108, '9e6faf9f-38b6-446b-ab88-8825558a5b93', 100, NULL, 'Vaccin contre la grippe', '2024-11-10', NULL),
(109, '390906007', 101, 'Type 2 Diabetes Mellitus', 'Diagnostiquée le: 10/09/2025', '2025-09-10', NULL),
(110, '390906007', 101, 'Hypertension', 'Diagnostiquée le: 10/12/2018', '2018-12-10', NULL),
(111, '390906007', 102, 'Shellfish', 'Allergie au shellfish', '2016-11-10', NULL),
(112, 'RÉSUMÉ DES CONSULTATIONS', 103, 'N/A', 'Aucune allergie connue', NULL, NULL),
(113, '390906007', 104, 'Aucune allergie connue', 'Aucune allergie connue', NULL, NULL),
(114, 'Visite le 10 octobre 2024 à Inconnu', 105, NULL, 'Hypertension', '2020-10-10', NULL),
(115, 'Visite le 10 octobre 2024 à Inconnu', 105, NULL, 'Amlodipine 5 mg', '2020-07-11', NULL),
(116, 'Visite le 10 octobre 2024 à Inconnu', 105, NULL, 'Vaccin contre la grippe', '2024-11-10', NULL),
(117, 'Visite le 10 octobre 2024 à Inconnu', 105, NULL, 'Vaccin COVID-19 (rappel)', '2024-07-10', NULL),
(118, '390906007', 106, NULL, 'Aucune allergie connue', NULL, NULL),
(119, '390906007', 107, NULL, 'Aucune allergie connue', NULL, NULL),
(120, 'Rapport médical non spécifié', 108, 'Peanuts', 'Allergie aux arachides', '2006-10-11', NULL),
(121, '390906007', 110, 'Aucune allergie connue', 'Aucune allergie connue', NULL, NULL),
(122, '390906007', 111, NULL, 'Aucune allergie connue', NULL, NULL),
(123, '390906007', 112, NULL, 'Aucune allergie connue', NULL, NULL),
(124, '390906007', 113, NULL, 'Aucune allergie connue', '2024-10-10', NULL),
(125, '390906007', 114, 'Hypertension', 'Diagnostiquée le 10/06/2014', NULL, NULL),
(126, '390906007', 114, 'Ramipril 5 mg', 'Actif', NULL, NULL),
(127, '390906007', 114, 'Blood pressure: 114/94 mmHg', 'Date: 10/04/2024', NULL, NULL),
(128, '390906007', 114, 'Heart rate: 68 bpm', 'Date: 10/04/2024', NULL, NULL),
(129, '390906007', 114, 'Body temperature: 37.6 C', 'Date: 10/04/2024', NULL, NULL),
(130, '390906007', 114, 'Total cholesterol: 220 mg/dL', 'Date: 10/04/2024', NULL, NULL),
(131, '390906007', 114, 'Vaccin contre la grippe', 'Administré le: 10 novembre 2024', NULL, NULL),
(132, '390906007', 115, 'Dairy', 'Allergie au lait', '2015-11-10', NULL),
(133, '390906007', 115, 'Peanuts', 'Allergie aux arachides', '2012-11-10', NULL),
(134, '390906007', 116, NULL, 'Pneumococcal (elderly)', '2023-06-10', NULL),
(135, '390906007', 117, NULL, NULL, '1971-11-03', NULL),
(136, '390906007', 117, NULL, NULL, NULL, NULL),
(137, '390906007', 118, NULL, 'Aucune allergie connue', NULL, NULL),
(138, '17bf742b-8704-457e-8c08-5c6c484967bb', 119, 'Amlodipine 5 mg', 'Traitement en cours', '2024-11-18', NULL),
(139, '17bf742b-8704-457e-8c08-5c6c484967bb', 119, 'Salbutamol 100 mcg inhaler', 'Traitement en cours', '2024-01-10', NULL),
(140, 'consultation-2025-11-10', 120, 'Latex', 'Allergie à la latex', '2007-11-10', NULL),
(141, 'consultation-2025-11-10', 120, 'Penicillin', 'Allergie au pénicilline', '2021-11-10', NULL),
(142, 'e84fef72-c630-48ef-86e8-3e308d265984', 121, NULL, 'Aucune allergie connue', NULL, NULL),
(143, '390906007', 122, 'Peanuts', 'Allergie aux arachides', '2016-11-10', NULL),
(144, '390906007', 122, 'Eggs', 'Allergie aux œufs', '2016-11-10', NULL),
(145, '390906007', 124, 'Hypertension', 'Hypertension', '2022-09-10', NULL),
(146, '390906007', 124, 'Type 2 Diabetes Mellitus', 'Type 2 Diabetes Mellitus', '2024-11-10', NULL),
(147, '390906007', 126, NULL, 'Vaccin tétanos (rappel)', '2020-11-10', NULL),
(148, '390906007', 126, NULL, 'Vaccin COVID-19 (rappel)', '2024-07-10', NULL),
(149, '390906007', 126, NULL, 'Vaccin contre la grippe', '2024-11-10', NULL),
(150, 'RÉSUMÉ DES CONSULTATIONS', 127, 'Aucune allergie connue', 'Aucune allergie connue', NULL, NULL),
(151, '390906007', 128, NULL, 'Pneumococcal', '2024-10-10', NULL),
(152, '390906007', 128, NULL, 'Aucune allergie connue', NULL, NULL),
(153, '390906007', 129, NULL, 'Aucune allergie connue', NULL, NULL),
(154, '390906007', 130, NULL, 'Allergie inconnue', '1974-06-01', NULL),
(155, '390906007', 130, NULL, 'Ancien fumeur', NULL, NULL),
(156, '390906007', 131, NULL, 'Influenza', '2023-07-10', NULL),
(157, '390906007', 132, NULL, 'Aucune allergie connue', NULL, NULL),
(158, '390906007', 133, NULL, 'Aucune allergie connue', NULL, NULL),
(159, '1453a080-d31f-4507-b99f-461e3edf21d1', 134, NULL, 'Aucune allergie connue', NULL, NULL),
(160, '75910d8e-c0a0-4487-982d-8595d32a471e', 135, NULL, 'Aucune allergie connue', NULL, NULL),
(161, 'RÉSUMÉ DES CONSULTATIONS', 136, 'Aucune allergie connue', 'Aucune allergie connue', NULL, NULL),
(162, 'RÉSUMÉ DES CONSULTATIONS', 137, 'VAC-COVID-19', 'Vaccin COVID-19 (rappel)', '2024-11-10', NULL),
(163, '390906007', 138, NULL, 'Aucune allergie connue', NULL, NULL),
(164, '390906007', 139, NULL, 'Amlodipine 5 mg', '2020-05-14', NULL),
(165, '390906007', 139, NULL, 'Vaccin contre la grippe', '2024-11-10', NULL);

-- --------------------------------------------------------

--
-- Structure de la table `dim_condition`
--

CREATE TABLE `dim_condition` (
  `condition_id` int(11) NOT NULL,
  `encounter_id` varchar(36) DEFAULT NULL,
  `patient_id` int(11) DEFAULT NULL,
  `code` varchar(50) DEFAULT NULL,
  `description` text DEFAULT NULL,
  `start_date` date DEFAULT NULL,
  `stop_date` date DEFAULT NULL
) ENGINE=InnoDB DEFAULT CHARSET=utf8mb4 COLLATE=utf8mb4_general_ci;

--
-- Déchargement des données de la table `dim_condition`
--

INSERT INTO `dim_condition` (`condition_id`, `encounter_id`, `patient_id`, `code`, `description`, `start_date`, `stop_date`) VALUES
(1, '390906007', 3, 'Hypertension', 'Hypertension', '2016-03-10', NULL),
(2, '390906007', 3, 'Influenza', 'Influenza', '2022-08-10', NULL),
(3, '390906007', 3, 'Blood pressure: 113/88 mmHg', 'Blood pressure: 113/88 mmHg', '2024-09-10', NULL),
(4, '390906007', 3, 'Heart rate: 115 bpm', 'Heart rate: 115 bpm', '2024-09-10', NULL),
(5, '390906007', 3, 'Body temperature: 38.0 C', 'Body temperature: 38.0 C', '2024-09-10', NULL),
(6, '390906007', 3, 'Total cholesterol: 245 mg/dL', 'Total cholesterol: 245 mg/dL', '2024-09-10', NULL),
(7, '390906007', 4, 'Hypertension', 'Hypertension', '2018-08-10', NULL),
(8, '390906007', 4, 'Ramipril 5 mg', 'Ramipril 5 mg', '2025-09-10', NULL),
(9, '390906007', 4, 'Blood pressure: 107/72 mmHg', 'Blood pressure: 107/72 mmHg', '2025-08-10', NULL),
(10, '390906007', 4, 'Heart rate: 61 bpm', 'Heart rate: 61 bpm', '2025-08-10', NULL),
(11, '390906007', 4, 'Body temperature: 36.9 C', 'Body temperature: 36.9 C', '2025-08-10', NULL),
(12, '390906007', 4, 'Total cholesterol: 216 mg/dL', 'Total cholesterol: 216 mg/dL', '2025-08-10', NULL),
(13, '390906007', 4, 'Vaccin contre la grippe', 'Vaccin contre la grippe', '2024-11-10', NULL),
(14, '390906007', 4, 'Vaccin COVID-19 (rappel)', 'Vaccin COVID-19 (rappel)', '2024-07-10', NULL),
(15, '390906007', 4, 'Imagerie du 10 mars 2025', 'Imagerie du 10 mars 2025', '2025-03-10', NULL),
(16, '390906007', 4, '390906007', '390906007', '2025-08-10', NULL),
(17, '390906007', 3, 'Hypertension', 'Diagnostiquée le 10/03/2016', '2016-03-10', NULL),
(18, '390906007', 3, 'Amlodipine 5 mg', 'Du 10/03/2016 au En cours', '2016-03-10', NULL),
(19, '390906007', 3, 'Influenza', 'Administré le 10 août 2022', '2022-08-10', NULL),
(20, '390906007', 3, 'Blood pressure: 113/88 mmHg', 'Date: 10/09/2024', '2024-09-10', NULL),
(21, '390906007', 3, 'Heart rate: 115 bpm', 'Date: 10/09/2024', '2024-09-10', NULL),
(22, '390906007', 3, 'Body temperature: 38.0 C', 'Date: 10/09/2024', '2024-09-10', NULL),
(23, '390906007', 3, 'Total cholesterol: 245 mg/dL', 'Date: 10/09/2024', '2024-09-10', NULL),
(24, '390906007', 4, 'Hypertension', 'Hypertension', '2018-08-10', NULL),
(25, '390906007', 4, 'Ramipril 5 mg', 'Ramipril 5 mg', '2025-09-10', NULL),
(26, '390906007', 4, 'Blood pressure: 107/72 mmHg', 'Blood pressure: 107/72 mmHg', '2025-08-10', NULL),
(27, '390906007', 4, 'Heart rate: 61 bpm', 'Heart rate: 61 bpm', '2025-08-10', NULL),
(28, '390906007', 4, 'Body temperature: 36.9 C', 'Body temperature: 36.9 C', '2025-08-10', NULL),
(29, '390906007', 4, 'Total cholesterol: 216 mg/dL', 'Total cholesterol: 216 mg/dL', '2025-08-10', NULL),
(30, '390906007', 4, 'Vaccin contre la grippe', 'Vaccin contre la grippe', '2024-11-10', NULL),
(31, '390906007', 4, 'Vaccin COVID-19 (rappel)', 'Vaccin COVID-19 (rappel)', '2024-07-10', NULL),
(32, '390906007', 4, 'Imagerie du 10 mars 2025', 'Imagerie du 10 mars 2025', '2025-03-10', NULL),
(33, '390906007', 5, 'Ostéoporose', 'Diagnostiquée le: N/A', '2007-07-21', NULL),
(34, '390906007', 5, 'Arthrose', 'Diagnostiquée le: N/A', '2007-07-21', NULL),
(35, '390906007', 5, 'Hypertension', 'Diagnostiquée le: 2007-07-10', '2007-07-10', NULL),
(36, '390906007', 5, 'Pneumococcal', 'Administré le: 2025-09-10', '2025-09-10', NULL),
(37, '390906007', 6, 'Type 2 Diabetes Mellitus', 'Diagnostiquée le: 10/07/2025', '2025-07-10', NULL),
(38, '390906007', 6, 'Hypertension', 'Diagnostiquée le: 10/02/2013', '2013-02-10', NULL),
(39, '390906007', 6, 'Peanuts', 'Identifiée le: 10/11/2017', '2017-11-10', NULL),
(40, '390906007', 6, 'Pneumococcal', 'Administré le: 10 avril 2025', '2025-04-10', NULL),
(41, '390906007', 7, 'HTA', 'Hypertension', '2018-10-10', NULL),
(42, '390906007', 7, 'Asthma', 'Asthma', '2021-10-10', NULL),
(43, 'RÉSUMÉ DES CONSULTATIONS', 8, 'Hypertension', 'Hypertension', '2013-01-10', NULL),
(44, 'RÉSUMÉ DES CONSULTATIONS', 8, 'Ostéoporose', 'Ostéoporose', NULL, NULL),
(45, 'RÉSUMÉ DES CONSULTATIONS', 8, 'Arthrose', 'Arthrose', NULL, NULL),
(46, '390906007', 9, 'Amlodipine 5 mg', 'Traitement en cours', '2024-07-31', NULL),
(47, '390906007', 9, 'Hypertension', 'Diagnostiquée', '2024-07-10', NULL),
(48, '390906007', 9, 'Influenza', 'Vaccination', '2023-03-10', NULL),
(49, '390906007', 12, 'Hypertension', 'Hypertension', '2012-01-10', NULL),
(50, '390906007', 12, 'Ostéoporose', 'Ostéoporose', NULL, NULL),
(51, '390906007', 12, 'Arthrose', 'Arthrose', NULL, NULL),
(52, '390906007', 12, 'Allergie aux sulfamides', 'Allergie aux sulfamides', '2017-11-10', NULL),
(53, '390906007', 12, 'Allergie au latex', 'Allergie au latex', '2013-11-10', NULL),
(54, '390906007', 22, 'HTA', 'Hypertension', '2011-01-10', NULL),
(55, '390906007', 22, 'Influenza', 'Vaccination contre la grippe', '2021-05-10', NULL),
(56, '390906007', 22, 'Pneumococcal (elderly)', 'Vaccination pneumococcique (personnes âgées)', '2024-07-10', NULL),
(57, '390906007', 22, 'Amlodipine 5 mg', 'Traitement médicamenteux', '2024-10-10', NULL),
(58, '390906007', 26, 'Hypertension', 'Hypertension', '2020-10-10', NULL),
(59, '390906007', 26, 'Influenza', 'Influenza', '2021-10-10', '2021-10-10'),
(60, '390906007', 26, 'Pneumococcal', 'Pneumococcal', '2025-07-10', '2025-07-10'),
(61, '390906007', 28, 'Hypertension', 'Diagnostiquée le 10/02/2009', '2009-02-10', NULL),
(62, '390906007', 28, 'Vaccin contre la grippe', 'Administré le 10 novembre 2024', '2024-11-10', NULL),
(63, '390906007', 28, 'Vaccin COVID-19 (rappel)', 'Administré le 10 juillet 2024', '2024-07-10', NULL),
(64, '390906007', 28, 'Vaccin tétanos (rappel)', 'Administré le 10 novembre 2020', '2020-11-10', NULL),
(65, '390906007', 28, 'Imagerie', 'Imagerie du 10 décembre 2024, modalité: 366740001, site: 39607008', '2024-12-10', NULL),
(66, 'RÉSUMÉ DES CONSULTATIONS', 29, 'Amlodipine 5 mg', 'Traitement en cours', '2021-03-17', NULL),
(67, 'RÉSUMÉ DES CONSULTATIONS', 29, 'Hypertension', 'Diagnostiquée', '2021-03-10', '2021-03-10'),
(68, 'RÉSUMÉ DES CONSULTATIONS', 29, 'Latex', 'Allergie identifiée', '2017-11-10', NULL),
(69, 'RÉSUMÉ DES CONSULTATIONS', 29, 'Shellfish', 'Allergie identifiée', '2016-11-10', NULL),
(70, 'RÉSUMÉ DES CONSULTATIONS', 29, 'Influenza', 'Vaccination administrée', '2024-09-10', NULL),
(71, 'RÉSUMÉ DES CONSULTATIONS', 29, 'Imagerie', 'Étude d\'imagerie', '2025-09-10', NULL),
(72, '390906007', 30, 'Hypertension', 'Hypertension', '2015-07-10', NULL),
(73, '390906007', 30, 'Ostéoporose', 'Ostéoporose', NULL, NULL),
(74, '390906007', 30, 'Arthrose', 'Arthrose', NULL, NULL),
(75, '390906007', 30, 'Blood pressure: 118/86 mmHg', 'Blood pressure: 118/86 mmHg', '2024-08-10', NULL),
(76, '390906007', 30, 'Heart rate: 80 bpm', 'Heart rate: 80 bpm', '2024-08-10', NULL),
(77, '390906007', 30, 'Body temperature: 37.3 C', 'Body temperature: 37.3 C', '2024-08-10', NULL),
(78, '390906007', 30, 'Total cholesterol: 200 mg/dL', 'Total cholesterol: 200 mg/dL', '2024-08-10', NULL),
(79, '390906007', 30, 'Pneumococcal (elderly)', 'Pneumococcal (elderly)', '2025-06-10', NULL),
(80, '390906007', 32, 'Hypertension', 'Hypertension', '2017-09-10', NULL),
(81, '390906007', 32, 'Ostéoporose', 'Ostéoporose', NULL, NULL),
(82, '390906007', 32, 'Arthrose', 'Arthrose', NULL, NULL),
(83, '390906007', 32, 'Amlodipine 5 mg', 'Amlodipine 5 mg', '2024-09-10', NULL),
(84, '390906007', 33, 'HTA', 'Hypertension', '2019-06-10', NULL),
(85, '390906007', 33, 'Pneumococcal (elderly)', 'Vaccination pneumococcale (âge avancé)', '2023-09-10', NULL),
(86, '390906007', 33, 'Amlodipine 5 mg', 'Traitement avec Amlodipine 5 mg', '2025-04-10', NULL),
(87, '390906007', 33, 'Ramipril 5 mg', 'Traitement avec Ramipril 5 mg', '2025-08-10', NULL),
(88, 'Visite le 10 mai 2025 à Inconnu', 35, 'Hypertension', 'Hypertension', '2020-09-10', NULL),
(89, 'Visite le 10 mai 2025 à Inconnu', 35, 'Ostéoporose', 'Ostéoporose', NULL, NULL),
(90, 'Visite le 10 mai 2025 à Inconnu', 35, 'Arthrose', 'Arthrose', NULL, NULL),
(91, '01f0378a-80a5-4dd3-8094-afa971205da1', 36, 'Amlodipine 5 mg', 'Médicament', '2022-12-21', NULL),
(92, '01f0378a-80a5-4dd3-8094-afa971205da1', 36, 'Hypertension', 'Pathologie', '2022-12-10', '2025-02-10'),
(93, '01f0378a-80a5-4dd3-8094-afa971205da1', 36, 'Blood pressure measurement', 'Procédure', '2024-12-10', '2024-12-10'),
(94, '01f0378a-80a5-4dd3-8094-afa971205da1', 36, 'Vaccin contre la grippe', 'Vaccination', '2024-11-10', '2024-11-10'),
(95, '01f0378a-80a5-4dd3-8094-afa971205da1', 36, 'Vaccin COVID-19 (rappel)', 'Vaccination', '2024-07-10', '2024-07-10'),
(96, '01f0378a-80a5-4dd3-8094-afa971205da1', 36, 'Vaccin tétanos (rappel)', 'Vaccination', '2020-11-10', '2020-11-10'),
(97, '01f0378a-80a5-4dd3-8094-afa971205da1', 36, 'Blood pressure: 119/89 mmHg', 'Observation', '2025-02-10', '2025-02-10'),
(98, '01f0378a-80a5-4dd3-8094-afa971205da1', 36, 'Heart rate: 116 bpm', 'Observation', '2025-02-10', '2025-02-10'),
(99, '01f0378a-80a5-4dd3-8094-afa971205da1', 36, 'Body temperature: 37.1 C', 'Observation', '2025-02-10', '2025-02-10'),
(100, '01f0378a-80a5-4dd3-8094-afa971205da1', 36, 'Blood pressure: 93/71 mmHg', 'Observation', '2025-11-10', '2025-11-10'),
(101, '01f0378a-80a5-4dd3-8094-afa971205da1', 36, 'Heart rate: 71 bpm', 'Observation', '2025-11-10', '2025-11-10'),
(102, '01f0378a-80a5-4dd3-8094-afa971205da1', 36, 'Body temperature: 36.8 C', 'Observation', '2025-11-10', '2025-11-10'),
(103, '01f0378a-80a5-4dd3-8094-afa971205da1', 36, '390906007', 'Visite', '2025-02-10', '2025-02-10'),
(104, '01f0378a-80a5-4dd3-8094-afa971205da1', 36, '390906007', 'Visite', '2025-11-10', '2025-11-10'),
(105, '01f0378a-80a5-4dd3-8094-afa971205da1', 36, '390906007', 'Visite', '2025-11-10', '2025-11-10'),
(106, '390906007', 38, 'Hypertension', 'Hypertension', '2009-10-10', NULL),
(107, '390906007', 38, 'Ostéoporose', 'Ostéoporose', NULL, NULL),
(108, '390906007', 38, 'Arthrose', 'Arthrose', NULL, NULL),
(109, '390906007', 38, 'Influenza', 'Influenza', '2023-01-10', NULL),
(110, '390906007', 38, 'Pneumococcal (elderly)', 'Pneumococcal (elderly)', '2025-04-10', NULL),
(111, '390906007', 42, 'HTA', 'Hypertension', '2009-04-10', NULL),
(112, '390906007', 42, 'Losartan 50 mg', 'Traitement pour hypertension', '2024-08-10', NULL),
(113, '390906007', 42, 'Blood pressure: 136/89 mmHg', 'Mesure de la pression artérielle', '2024-02-10', NULL),
(114, '390906007', 42, 'Heart rate: 109 bpm', 'Mesure du rythme cardiaque', '2024-02-10', NULL),
(115, '390906007', 42, 'Body temperature: 37.8 C', 'Mesure de la température corporelle', '2024-02-10', NULL),
(116, '390906007', 42, 'Total cholesterol: 156 mg/dL', 'Mesure du cholestérol total', '2024-02-10', NULL),
(117, '390906007', 42, 'Vaccin contre la grippe', 'Vaccination contre la grippe', '2024-11-10', NULL),
(118, '390906007', 42, 'Vaccin COVID-19 (rappel)', 'Vaccination COVID-19', '2024-07-10', NULL),
(119, '390906007', 42, 'Vaccin tétanos (rappel)', 'Vaccination tétanos', '2020-11-10', NULL),
(120, '390906007', 45, 'HTA', 'Hypertension', '2015-08-10', NULL),
(121, '390906007', 45, 'AML', 'Amlodipine 5 mg', '2015-09-02', NULL),
(122, '390906007', 45, 'VGG', 'Vaccin contre la grippe', '2024-11-10', NULL),
(123, '390906007', 45, 'VCO', 'Vaccin COVID-19 (rappel)', '2024-07-10', NULL),
(124, '390906007', 45, 'TTN', 'Vaccin tétanos (rappel)', '2020-11-10', NULL),
(125, '390906007', 45, 'BP', 'Blood pressure', '2025-02-10', NULL),
(126, '390906007', 45, 'HR', 'Heart rate', '2025-02-10', NULL),
(127, '390906007', 45, 'BT', 'Body temperature', '2025-02-10', NULL),
(128, '390906007', 45, 'TC', 'Total cholesterol', '2025-02-10', NULL),
(129, '390906007', 46, 'Hypertension', 'Hypertension', '2007-04-10', NULL),
(130, '390906007', 46, 'Ostéoporose', 'Ostéoporose', NULL, NULL),
(131, '390906007', 46, 'Arthrose', 'Arthrose', NULL, NULL),
(132, '390906007', 46, 'Pneumococcal (elderly)', 'Pneumococcal (elderly)', '2025-07-10', NULL),
(133, '390906007', 47, 'Hypertension', 'Hypertension', '2022-03-10', NULL),
(134, '390906007', 47, 'Bisoprolol 5 mg', 'Bisoprolol 5 mg', '2024-04-10', NULL),
(135, '390906007', 47, 'Influenza', 'Influenza', '2021-04-10', NULL),
(136, '390906007', 47, '366740001', 'Imagerie', '2025-09-10', NULL),
(137, '390906007', 48, 'HTA', 'Hypertension', '2020-07-10', NULL),
(138, '390906007', 48, 'Ostéoporose', 'Ostéoporose', NULL, NULL),
(139, '390906007', 48, 'Arthrose', 'Arthrose', NULL, NULL),
(140, '390906007', 48, 'Pneumococcal (elderly)', 'Vaccination pneumococcale (âge avancé)', '2022-02-10', NULL),
(141, '390906007', 49, 'Hypertension', 'Hypertension', '2012-10-05', NULL),
(142, '390906007', 49, 'Type 2 Diabetes Mellitus', 'Type 2 Diabetes Mellitus', '2024-05-10', NULL),
(143, '390906007', 50, 'Amlodipine 5 mg', 'Traitement en cours', '2014-12-20', NULL),
(144, '390906007', 50, 'Hypertension', 'Diagnostiquée', '2014-12-10', NULL),
(145, '390906007', 50, 'Pneumococcal', 'Vaccination', '2024-10-10', NULL),
(146, '390906007', 50, 'Imagerie', 'Imagerie du 10 juillet 2024', '2024-07-10', NULL),
(147, '390906007', 50, '390906007', 'Visite le 10 novembre 2024 à Inconnu', '2024-11-10', NULL),
(148, '390906007', 51, 'Hypertension', 'Hypertension', '2018-08-10', NULL),
(149, '390906007', 51, 'Ostéoporose', 'Ostéoporose', NULL, NULL),
(150, '390906007', 51, 'Arthrose', 'Arthrose', NULL, NULL),
(151, '390906007', 52, 'Hypertension', 'Hypertension', '2007-06-10', NULL),
(152, '390906007', 52, 'Type 2 Diabetes Mellitus', 'Type 2 Diabetes Mellitus', '2024-04-10', NULL),
(153, '390906007', 53, 'Hypertension', 'Hypertension', '2019-04-10', NULL),
(154, '390906007', 53, 'Ostéoporose', 'Ostéoporose', NULL, NULL),
(155, '390906007', 53, 'Arthrose', 'Arthrose', NULL, NULL),
(156, '390906007', 54, 'Hypertension', 'Hypertension', '2019-11-10', NULL),
(157, '390906007', 54, 'Type 2 Diabetes Mellitus', 'Type 2 Diabetes Mellitus', '2025-01-10', NULL),
(158, 'RÉSUMÉ DES CONSULTATIONS', 58, 'Hypertension', 'Hypertension', '2018-07-10', NULL),
(159, 'RÉSUMÉ DES CONSULTATIONS', 58, 'Ostéoporose', 'Ostéoporose', NULL, NULL),
(160, 'RÉSUMÉ DES CONSULTATIONS', 58, 'Arthrose', 'Arthrose', NULL, NULL),
(161, 'RÉSUMÉ DES CONSULTATIONS', 58, 'Amlodipine 5 mg', 'Amlodipine 5 mg', '2018-07-16', NULL),
(162, 'RÉSUMÉ DES CONSULTATIONS', 58, 'Blood pressure: 112/86 mmHg', 'Blood pressure: 112/86 mmHg', '2024-09-10', NULL),
(163, 'RÉSUMÉ DES CONSULTATIONS', 58, 'Heart rate: 62 bpm', 'Heart rate: 62 bpm', '2024-09-10', NULL),
(164, 'RÉSUMÉ DES CONSULTATIONS', 58, 'Body temperature: 37.3 C', 'Body temperature: 37.3 C', '2024-09-10', NULL),
(165, 'RÉSUMÉ DES CONSULTATIONS', 58, 'Total cholesterol: 228 mg/dL', 'Total cholesterol: 228 mg/dL', '2024-09-10', NULL),
(166, 'RÉSUMÉ DES CONSULTATIONS', 58, 'Vaccin contre la grippe', 'Vaccin contre la grippe', '2024-11-10', NULL),
(167, 'RÉSUMÉ DES CONSULTATIONS', 58, 'Vaccin COVID-19 (rappel)', 'Vaccin COVID-19 (rappel)', '2024-07-10', NULL),
(168, 'RÉSUMÉ DES CONSULTATIONS', 58, 'Vaccin tétanos (rappel)', 'Vaccin tétanos (rappel)', '2020-11-10', NULL),
(169, 'RÉSUMÉ DES CONSULTATIONS', 58, 'Visite le 10 septembre 2024 à Inconnu', 'Visite le 10 septembre 2024 à Inconnu', '2024-09-10', NULL),
(170, '390906007', 59, 'Hypertension', 'Hypertension', '2019-06-10', NULL),
(171, '390906007', 59, 'Type 2 Diabetes Mellitus', 'Type 2 Diabetes Mellitus', '2024-09-10', NULL),
(172, '390906007', 62, 'Amlodipine 5 mg', 'Médicament', '2021-08-23', NULL),
(173, '390906007', 62, 'Hypertension', 'Pathologie', '2021-08-10', '2021-08-10'),
(174, '390906007', 62, 'Influenza', 'Vaccination', '2021-04-10', '2021-04-10'),
(175, '390906007', 62, 'Pneumococcal', 'Vaccination', '2025-11-10', '2025-11-10'),
(176, '390906007', 62, 'Imagerie', 'Étude d\'imagerie', '2024-09-10', '2024-09-10'),
(177, '390906007', 62, 'Blood pressure: 93/87 mmHg', 'Observation clé', '2024-12-10', '2024-12-10'),
(178, '390906007', 62, 'Heart rate: 73 bpm', 'Observation clé', '2024-12-10', '2024-12-10'),
(179, '390906007', 62, 'Body temperature: 37.0 C', 'Observation clé', '2024-12-10', '2024-12-10'),
(180, '390906007', 62, 'Total cholesterol: 151 mg/dL', 'Observation clé', '2024-12-10', '2024-12-10'),
(181, '390906007', 62, '390906007', 'Code de consultation', '2024-12-10', '2024-12-10'),
(182, 'RÉSUMÉ DES CONSULTATIONS', 63, 'Amlodipine 5 mg', 'Médicament', '2018-04-29', NULL),
(183, 'RÉSUMÉ DES CONSULTATIONS', 63, 'Hypertension', 'Pathologie', '2018-04-10', NULL),
(184, 'RÉSUMÉ DES CONSULTATIONS', 63, 'Blood pressure: 115/95 mmHg', 'Observation clé', '2024-01-10', NULL),
(185, 'RÉSUMÉ DES CONSULTATIONS', 63, 'Heart rate: 100 bpm', 'Observation clé', '2024-01-10', NULL),
(186, 'RÉSUMÉ DES CONSULTATIONS', 63, 'Body temperature: 36.7 C', 'Observation clé', '2024-01-10', NULL),
(187, 'RÉSUMÉ DES CONSULTATIONS', 63, 'Total cholesterol: 247 mg/dL', 'Observation clé', '2024-01-10', NULL),
(188, 'RÉSUMÉ DES CONSULTATIONS', 63, 'Vaccin contre la grippe', 'Vaccination', '2024-11-10', NULL),
(189, 'RÉSUMÉ DES CONSULTATIONS', 63, 'Imagerie du 10 octobre 2025', 'Étude d\'imagerie', '2025-10-10', NULL),
(190, '390906007', 64, 'Hypertension', 'Hypertension', '2024-06-10', NULL),
(191, '390906007', 64, 'Amlodipine 5 mg', 'Amlodipine 5 mg', '2024-07-02', NULL),
(192, '390906007', 64, 'Blood pressure: 124/72 mmHg', 'Blood pressure: 124/72 mmHg', '2024-11-10', NULL),
(193, '390906007', 64, 'Heart rate: 75 bpm', 'Heart rate: 75 bpm', '2024-11-10', NULL),
(194, '390906007', 64, 'Body temperature: 37.2 C', 'Body temperature: 37.2 C', '2024-11-10', NULL),
(195, '390906007', 64, 'Total cholesterol: 231 mg/dL', 'Total cholesterol: 231 mg/dL', '2024-11-10', NULL),
(196, '390906007', 64, 'Vaccin contre la grippe', 'Vaccin contre la grippe', '2024-11-10', NULL),
(197, '390906007', 64, 'Imagerie du 10 mai 2025', 'Imagerie du 10 mai 2025', '2025-05-10', NULL),
(198, '390906007', 65, 'Hypertension', 'Hypertension', '2020-03-10', NULL),
(199, '390906007', 65, 'Amlodipine 5 mg', 'Amlodipine 5 mg', '2020-03-23', NULL),
(200, '390906007', 65, 'Blood pressure: 97/87 mmHg', 'Blood pressure: 97/87 mmHg', '2024-01-10', NULL),
(201, '390906007', 65, 'Heart rate: 86 bpm', 'Heart rate: 86 bpm', '2024-01-10', NULL),
(202, '390906007', 65, 'Body temperature: 37.7 C', 'Body temperature: 37.7 C', '2024-01-10', NULL),
(203, '390906007', 65, 'Total cholesterol: 211 mg/dL', 'Total cholesterol: 211 mg/dL', '2024-01-10', NULL),
(204, '390906007', 65, 'Influenza', 'Influenza', '2024-06-10', NULL),
(205, '390906007', 65, 'Pneumococcal', 'Pneumococcal', '2024-06-10', NULL),
(206, '390906007', 65, 'Imagerie du 10 juillet 2024', 'Imagerie du 10 juillet 2024', '2024-07-10', NULL),
(207, '390906007', 66, 'Ostéoporose', 'Diagnostiquée le: N/A', '2013-11-21', NULL),
(208, '390906007', 66, 'Arthrose', 'Diagnostiquée le: N/A', '2013-11-21', NULL),
(209, '390906007', 66, 'Hypertension', 'Diagnostiquée le: 10/11/2013', '2013-11-10', NULL),
(210, '390906007', 66, 'Blood pressure', '127/96 mmHg', '2025-10-03', NULL),
(211, '390906007', 66, 'Heart rate', '78 bpm', '2025-10-03', NULL),
(212, '390906007', 66, 'Body temperature', '37.9 C', '2025-10-03', NULL),
(213, '390906007', 66, 'Total cholesterol', '186 mg/dL', '2025-10-03', NULL),
(214, '390906007', 66, 'Pneumococcal (elderly)', 'Administré le: 10 octobre 2025', '2025-10-10', NULL),
(215, 'RÉSUMÉ DES CONSULTATIONS', 67, 'Amlodipine 5 mg', 'Médicament', '2023-08-26', NULL),
(216, 'RÉSUMÉ DES CONSULTATIONS', 67, 'Hypertension', 'Pathologie', '2023-08-10', '2023-08-10'),
(217, 'RÉSUMÉ DES CONSULTATIONS', 67, 'Blood pressure: 117/88 mmHg', 'Observation', '2024-01-10', '2024-01-10'),
(218, 'RÉSUMÉ DES CONSULTATIONS', 67, 'Heart rate: 83 bpm', 'Observation', '2024-01-10', '2024-01-10'),
(219, 'RÉSUMÉ DES CONSULTATIONS', 67, 'Body temperature: 36.8 C', 'Observation', '2024-01-10', '2024-01-10'),
(220, 'RÉSUMÉ DES CONSULTATIONS', 67, 'Total cholesterol: 159 mg/dL', 'Observation', '2024-01-10', '2024-01-10'),
(221, 'RÉSUMÉ DES CONSULTATIONS', 67, 'Imagerie du 10 avril 2024', 'Étude d\'imagerie', '2024-04-10', '2024-04-10'),
(222, 'RÉSUMÉ DES CONSULTATIONS', 67, 'Vaccin COVID-19 (rappel)', 'Vaccination', '2024-07-10', '2024-07-10'),
(223, 'RÉSUMÉ DES CONSULTATIONS', 67, 'Vaccin contre la grippe', 'Vaccination', '2024-11-10', '2024-11-10'),
(224, 'RÉSUMÉ DES CONSULTATIONS', 67, 'Dairy', 'Allergie', '2019-11-10', '2019-11-10'),
(225, 'RÉSUMÉ DES CONSULTATIONS', 67, 'Aspirin', 'Allergie', '2021-11-10', '2021-11-10'),
(226, '390906007', 68, 'Hypertension', 'Hypertension', '2020-07-10', NULL),
(227, '390906007', 68, 'Ostéoporose', 'Ostéoporose', NULL, NULL),
(228, '390906007', 68, 'Arthrose', 'Arthrose', NULL, NULL),
(229, '390906007', 68, 'Amlodipine 5 mg', 'Amlodipine 5 mg', '2023-12-10', NULL),
(230, '390906007', 68, 'Blood pressure: 131/66 mmHg', 'Blood pressure: 131/66 mmHg', '2023-12-10', NULL),
(231, '390906007', 68, 'Heart rate: 96 bpm', 'Heart rate: 96 bpm', '2023-12-10', NULL),
(232, '390906007', 68, 'Body temperature: 37.5 C', 'Body temperature: 37.5 C', '2023-12-10', NULL),
(233, '390906007', 68, 'Total cholesterol: 178 mg/dL', 'Total cholesterol: 178 mg/dL', '2023-12-10', NULL),
(234, '390906007', 68, 'Pneumococcal', 'Pneumococcal', '2025-09-10', NULL),
(235, '390906007', 68, 'Pneumococcal (elderly)', 'Pneumococcal (elderly)', '2025-10-10', NULL),
(236, '390906007', 69, 'Hypertension', 'Hypertension', '2010-03-10', NULL),
(237, '390906007', 69, 'Ostéoporose', 'Ostéoporose', NULL, NULL),
(238, '390906007', 69, 'Arthrose', 'Arthrose', NULL, NULL),
(239, '390906007', 69, 'Pneumococcal', 'Pneumococcal', '2021-10-10', NULL),
(240, '390906007', 69, 'Pneumococcal (elderly)', 'Pneumococcal (elderly)', '2025-07-10', NULL),
(241, '390906007', 70, 'Hypertension', 'Hypertension', '2018-04-10', NULL),
(242, '390906007', 70, 'Type 2 Diabetes Mellitus', 'Type 2 Diabetes Mellitus', '2023-12-23', NULL),
(243, '376af3da-1969-4bc6-947f-4b5d2be7b439', 71, 'Hypertension', 'Hypertension', '2006-12-10', NULL),
(244, '376af3da-1969-4bc6-947f-4b5d2be7b439', 71, 'Ostéoporose', 'Ostéoporose', NULL, NULL),
(245, '376af3da-1969-4bc6-947f-4b5d2be7b439', 71, 'Arthrose', 'Arthrose', NULL, NULL),
(246, '376af3da-1969-4bc6-947f-4b5d2be7b439', 71, 'Influenza', 'Influenza', '2023-03-10', NULL),
(247, '376af3da-1969-4bc6-947f-4b5d2be7b439', 71, 'Pneumococcal (elderly)', 'Pneumococcal (elderly)', '2023-08-10', NULL),
(248, '390906007', 73, 'Hypertension', 'Hypertension', '2014-07-10', NULL),
(249, '390906007', 73, 'Ostéoporose', 'Ostéoporose', NULL, NULL),
(250, '390906007', 73, 'Arthrose', 'Arthrose', NULL, NULL),
(251, '390906007', 74, 'Hypertension', 'Hypertension', '2012-05-10', NULL),
(252, '390906007', 74, 'Ostéoporose', 'Ostéoporose', NULL, NULL),
(253, '390906007', 74, 'Arthrose', 'Arthrose', NULL, NULL),
(254, '390906007', 74, 'Vaccin contre la grippe', 'Vaccin contre la grippe', '2024-11-10', NULL),
(255, '390906007', 74, 'Vaccin COVID-19 (rappel)', 'Vaccin COVID-19 (rappel)', '2024-07-10', NULL),
(256, '390906007', 74, 'Vaccin tétanos (rappel)', 'Vaccin tétanos (rappel)', '2020-11-10', NULL),
(257, '390906007', 75, 'Hypertension', 'Hypertension', '2011-03-10', NULL),
(258, '390906007', 75, 'Ostéoporose', 'Ostéoporose', NULL, NULL),
(259, '390906007', 75, 'Arthrose', 'Arthrose', NULL, NULL),
(260, '390906007', 76, 'Type 2 Diabetes Mellitus', 'Diagnostiquée le: 10/01/2024', '2024-01-10', NULL),
(261, '390906007', 76, 'Hypertension', 'Diagnostiquée le: 10/03/2011', '2011-03-10', NULL),
(262, 'RÉSUMÉ DES CONSULTATIONS', 77, 'Hypertension', 'Hypertension (Diagnostiquée le: 10/05/2021)', '2021-05-25', NULL),
(263, 'RÉSUMÉ DES CONSULTATIONS', 77, 'Amlodipine 5 mg', 'Amlodipine 5 mg [Du 25/05/2021 au En cours] (Actif)', '2021-05-25', NULL),
(264, 'RÉSUMÉ DES CONSULTATIONS', 77, 'Blood pressure: 105/99 mmHg', 'Blood pressure: 105/99 mmHg (Date: 10/04/2025)', '2025-04-10', NULL),
(265, 'RÉSUMÉ DES CONSULTATIONS', 77, 'Heart rate: 81 bpm', 'Heart rate: 81 bpm (Date: 10/04/2025)', '2025-04-10', NULL),
(266, 'RÉSUMÉ DES CONSULTATIONS', 77, 'Body temperature: 37.0 C', 'Body temperature: 37.0 C (Date: 10/04/2025)', '2025-04-10', NULL),
(267, 'RÉSUMÉ DES CONSULTATIONS', 77, 'Total cholesterol: 185 mg/dL', 'Total cholesterol: 185 mg/dL (Date: 10/04/2025)', '2025-04-10', NULL),
(268, 'RÉSUMÉ DES CONSULTATIONS', 77, 'Vaccin contre la grippe', 'Vaccin contre la grippe (Administré le: 10 novembre 2024)', '2024-11-10', NULL),
(269, 'RÉSUMÉ DES CONSULTATIONS', 77, 'Vaccin COVID-19 (rappel)', 'Vaccin COVID-19 (rappel) (Administré le: 10 juillet 2024)', '2024-07-10', NULL),
(270, 'RÉSUMÉ DES CONSULTATIONS', 77, 'Vaccin tétanos (rappel)', 'Vaccin tétanos (rappel) (Administré le: 10 novembre 2020)', '2020-11-10', NULL),
(271, '390906007', 79, 'Amlodipine 5 mg', 'Médicament', '2020-04-23', NULL),
(272, '390906007', 79, 'Hypertension', 'Pathologie', '2020-04-10', NULL),
(273, '390906007', 79, 'Influenza', 'Vaccination', '2023-06-10', NULL),
(274, '390906007', 79, 'Imagerie', 'Étude d\'imagerie', '2023-12-10', NULL),
(275, '390906007', 79, 'Blood pressure: 104/87 mmHg', 'Observation clé', '2025-10-10', NULL),
(276, '390906007', 79, 'Heart rate: 81 bpm', 'Observation clé', '2025-10-10', NULL),
(277, '390906007', 79, 'Body temperature: 36.6 C', 'Observation clé', '2025-10-10', NULL),
(278, '390906007', 79, 'Total cholesterol: 195 mg/dL', 'Observation clé', '2025-10-10', NULL),
(279, '390906007', 80, 'HTA', 'Hypertension', '2023-10-10', NULL),
(280, '390906007', 80, 'AML', 'Amlodipine 5 mg', '2023-10-16', NULL),
(281, '390906007', 80, 'BP', 'Blood pressure', '2024-02-10', NULL),
(282, '390906007', 80, 'HR', 'Heart rate', '2024-02-10', NULL),
(283, '390906007', 80, 'BT', 'Body temperature', '2024-02-10', NULL),
(284, '390906007', 80, 'TC', 'Total cholesterol', '2024-02-10', NULL),
(285, '390906007', 80, 'VG', 'Vaccin contre la grippe', '2024-11-10', NULL),
(286, '390906007', 80, 'VCO', 'Vaccin COVID-19 (rappel)', '2024-07-10', NULL),
(287, '390906007', 80, 'TT', 'Vaccin tétanos (rappel)', '2020-11-10', NULL),
(288, '390906007', 82, 'Type 2 Diabetes Mellitus', 'Diagnostiquée le: 10/07/2025', '2025-07-10', NULL),
(289, '390906007', 82, 'Hypertension', 'Diagnostiquée le: 10/01/2009', '2009-01-10', NULL),
(290, '390906007', 83, 'Hypertension', 'Hypertension', '2023-02-10', NULL),
(291, '390906007', 83, 'Amlodipine 5 mg', 'Amlodipine 5 mg', '2023-02-21', NULL),
(292, '390906007', 83, 'Blood pressure: 102/68 mmHg', 'Blood pressure: 102/68 mmHg', '2024-03-10', NULL),
(293, '390906007', 83, 'Heart rate: 100 bpm', 'Heart rate: 100 bpm', '2024-03-10', NULL),
(294, '390906007', 83, 'Body temperature: 36.5 C', 'Body temperature: 36.5 C', '2024-03-10', NULL),
(295, '390906007', 83, 'Total cholesterol: 155 mg/dL', 'Total cholesterol: 155 mg/dL', '2024-03-10', NULL),
(296, '390906007', 83, 'Vaccin contre la grippe', 'Vaccin contre la grippe', '2024-11-10', NULL),
(297, '390906007', 83, 'Vaccin COVID-19 (rappel)', 'Vaccin COVID-19 (rappel)', '2024-07-10', NULL),
(298, '390906007', 83, 'Vaccin tétanos (rappel)', 'Vaccin tétanos (rappel)', '2020-11-10', NULL),
(299, '390906007', 83, 'Imagerie du 10 octobre 2024', 'Imagerie du 10 octobre 2024', '2024-10-10', NULL),
(300, 'fcd411f5-6cf4-46ce-aa34-efabee789c5c', 85, 'Hypertension', 'Hypertension', '2008-05-10', NULL),
(301, 'fcd411f5-6cf4-46ce-aa34-efabee789c5c', 85, 'Ostéoporose', 'Ostéoporose', NULL, NULL),
(302, 'fcd411f5-6cf4-46ce-aa34-efabee789c5c', 85, 'Arthrose', 'Arthrose', NULL, NULL),
(303, 'Visite le 10 novembre 2025 à Inconnu', 86, 'HTA', 'Hypertension', '2015-01-10', NULL),
(304, 'Visite le 10 novembre 2025 à Inconnu', 86, 'Amlodipine', 'Amlodipine 5 mg', '2025-02-10', NULL),
(305, 'Visite le 10 novembre 2025 à Inconnu', 86, 'Ramipril', 'Ramipril 5 mg', '2025-06-10', NULL),
(306, 'Visite le 10 novembre 2025 à Inconnu', 86, 'Vaccin contre la grippe', 'Vaccin contre la grippe', '2024-11-10', NULL),
(307, '390906007', 87, 'Amlodipine 5 mg', 'Médicament', '2019-08-17', NULL),
(308, '390906007', 87, 'Hypertension', 'Pathologie', '2019-08-10', NULL),
(309, '390906007', 87, 'Influenza', 'Vaccination', '2024-06-10', NULL),
(310, '390906007', 87, 'Imagerie', 'Étude d\'imagerie', '2025-06-10', NULL),
(311, '390906007', 87, 'Consultation', 'Résultat de la consultation', '2025-09-10', NULL),
(312, '390906007', 88, 'Hypertension', 'Hypertension', '2020-05-10', NULL),
(313, '390906007', 88, 'Type 2 Diabetes Mellitus', 'Type 2 Diabetes Mellitus', '2024-05-10', NULL),
(314, '390906007', 89, 'Hypertension', 'Hypertension', '2015-10-10', NULL),
(315, '390906007', 89, 'Losartan 50 mg', 'Losartan 50 mg', '2024-01-10', NULL),
(316, '390906007', 89, 'Vaccin COVID-19 (rappel)', 'Vaccin COVID-19 (rappel)', '2024-07-10', NULL),
(317, '390906007', 89, 'Vaccin contre la grippe', 'Vaccin contre la grippe', '2024-11-10', NULL),
(318, '390906007', 89, 'Imagerie', 'Imagerie', '2025-02-10', NULL),
(319, '390906007', 89, 'Blood pressure: 110/65 mmHg', 'Blood pressure: 110/65 mmHg', '2025-05-10', NULL),
(320, '390906007', 89, 'Heart rate: 78 bpm', 'Heart rate: 78 bpm', '2025-05-10', NULL),
(321, '390906007', 89, 'Body temperature: 36.9 C', 'Body temperature: 36.9 C', '2025-05-10', NULL),
(322, '390906007', 89, 'Total cholesterol: 224 mg/dL', 'Total cholesterol: 224 mg/dL', '2025-05-10', NULL),
(323, '390906007', 90, 'Hypertension', 'Hypertension', '2018-01-10', NULL),
(324, '390906007', 90, 'Ostéoporose', 'Ostéoporose', NULL, NULL),
(325, '390906007', 90, 'Arthrose', 'Arthrose', NULL, NULL),
(326, '390906007', 91, 'Amlodipine 5 mg', 'Traitement en cours', '2019-07-28', NULL),
(327, '390906007', 91, 'Hypertension', 'Diagnostiquée', '2019-07-10', NULL),
(328, '390906007', 91, 'Blood pressure: 124/89 mmHg', 'Mesure pertinente', '2024-03-10', NULL),
(329, '390906007', 91, 'Heart rate: 117 bpm', 'Mesure pertinente', '2024-03-10', NULL),
(330, '390906007', 91, 'Body temperature: 37.8 C', 'Mesure pertinente', '2024-03-10', NULL),
(331, '390906007', 91, 'Total cholesterol: 166 mg/dL', 'Mesure pertinente', '2024-03-10', NULL),
(332, '390906007', 91, 'Vaccin contre la grippe', 'Administré', '2024-11-10', NULL),
(333, '390906007', 92, 'E11', 'Diabète de type 2', '2025-09-10', NULL),
(334, '390906007', 92, 'I10', 'Hypertension', '2015-06-10', NULL),
(335, 'RÉSUMÉ DES CONSULTATIONS', 93, 'Hypertension', 'Hypertension', '2012-11-10', NULL),
(336, 'RÉSUMÉ DES CONSULTATIONS', 93, 'Ostéoporose', 'Ostéoporose', NULL, NULL),
(337, 'RÉSUMÉ DES CONSULTATIONS', 93, 'Arthrose', 'Arthrose', NULL, NULL),
(338, 'RÉSUMÉ DES CONSULTATIONS', 93, 'Vaccin contre la grippe', 'Vaccin contre la grippe', '2024-11-10', NULL),
(339, 'RÉSUMÉ DES CONSULTATIONS', 93, 'Vaccin COVID-19 (rappel)', 'Vaccin COVID-19 (rappel)', '2024-07-10', NULL),
(340, 'RÉSUMÉ DES CONSULTATIONS', 93, 'Vaccin tétanos (rappel)', 'Vaccin tétanos (rappel)', '2020-11-10', NULL),
(341, '390906007', 94, 'Hypertension', 'Hypertension', '2021-11-10', NULL),
(342, '390906007', 94, 'Losartan 50 mg', 'Losartan 50 mg', '2024-04-10', NULL),
(343, '390906007', 94, 'Pneumococcal', 'Pneumococcal', '2025-01-10', NULL),
(344, '390906007', 95, 'Type 2 Diabetes Mellitus', 'Diagnostiquée le: 10/10/2025', '2025-10-10', NULL),
(345, '390906007', 95, 'Hypertension', 'Diagnostiquée le: 10/01/2017', '2017-01-10', NULL),
(346, 'ca995412-7cbb-401a-97b1-fb6d3324487b', 97, 'HTA', 'Hypertension', '2021-01-10', NULL),
(347, 'ca995412-7cbb-401a-97b1-fb6d3324487b', 97, 'Amlodipine', 'Amlodipine 5 mg', '2021-01-11', NULL),
(348, 'ca995412-7cbb-401a-97b1-fb6d3324487b', 97, 'Vaccin contre la grippe', 'Vaccin contre la grippe', '2024-11-10', NULL),
(349, 'ca995412-7cbb-401a-97b1-fb6d3324487b', 97, 'Vaccin COVID-19 (rappel)', 'Vaccin COVID-19 (rappel)', '2024-07-10', NULL),
(350, 'ca995412-7cbb-401a-97b1-fb6d3324487b', 97, 'Vaccin tétanos (rappel)', 'Vaccin tétanos (rappel)', '2020-11-10', NULL),
(351, 'ca995412-7cbb-401a-97b1-fb6d3324487b', 97, 'Mesure de la pression artérielle', 'Mesure de la pression artérielle', '2024-12-10', NULL),
(352, '390906007', 98, 'Amlodipine 5 mg', 'Médicament', '2007-08-16', NULL),
(353, '390906007', 98, 'Hypertension', 'Pathologie', '2007-08-10', NULL),
(354, '390906007', 98, 'Vaccin contre la grippe', 'Vaccination', '2024-11-10', NULL),
(355, '390906007', 98, 'Vaccin COVID-19 (rappel)', 'Vaccination', '2024-07-10', NULL),
(356, '390906007', 98, 'Blood pressure: 114/73 mmHg', 'Observation', '2025-09-10', NULL),
(357, '390906007', 98, 'Heart rate: 88 bpm', 'Observation', '2025-09-10', NULL),
(358, '390906007', 98, 'Body temperature: 36.6 C', 'Observation', '2025-09-10', NULL),
(359, '390906007', 98, 'Total cholesterol: 174 mg/dL', 'Observation', '2025-09-10', NULL),
(360, '390906007', 99, 'Amlodipine 5 mg', 'Médicament', '2017-10-18', NULL),
(361, '390906007', 99, 'Hypertension', 'Pathologie', '2017-10-10', '2024-10-10'),
(362, '390906007', 99, 'Blood pressure: 122/98 mmHg', 'Observation', '2024-10-10', NULL),
(363, '390906007', 99, 'Heart rate: 98 bpm', 'Observation', '2024-10-10', NULL),
(364, '390906007', 99, 'Body temperature: 36.9 C', 'Observation', '2024-10-10', NULL),
(365, '390906007', 99, 'Total cholesterol: 214 mg/dL', 'Observation', '2024-10-10', NULL),
(366, '390906007', 99, 'Vaccin contre la grippe', 'Vaccination', '2024-11-10', NULL),
(367, '390906007', 99, 'Vaccin COVID-19 (rappel)', 'Vaccination', '2024-07-10', NULL),
(368, '9e6faf9f-38b6-446b-ab88-8825558a5b93', 100, 'Hypertension', 'Hypertension', '2021-11-10', NULL),
(369, '9e6faf9f-38b6-446b-ab88-8825558a5b93', 100, 'Amlodipine 5 mg', 'Amlodipine 5 mg', '2024-03-10', NULL),
(370, '9e6faf9f-38b6-446b-ab88-8825558a5b93', 100, 'Ramipril 5 mg', 'Ramipril 5 mg', '2024-08-10', NULL),
(371, '9e6faf9f-38b6-446b-ab88-8825558a5b93', 100, 'Blood pressure: 126/86 mmHg', 'Blood pressure: 126/86 mmHg', '2024-09-10', NULL),
(372, '9e6faf9f-38b6-446b-ab88-8825558a5b93', 100, 'Heart rate: 88 bpm', 'Heart rate: 88 bpm', '2024-09-10', NULL),
(373, '9e6faf9f-38b6-446b-ab88-8825558a5b93', 100, 'Body temperature: 37.8 C', 'Body temperature: 37.8 C', '2024-09-10', NULL),
(374, '9e6faf9f-38b6-446b-ab88-8825558a5b93', 100, 'Total cholesterol: 175 mg/dL', 'Total cholesterol: 175 mg/dL', '2024-09-10', NULL),
(375, '9e6faf9f-38b6-446b-ab88-8825558a5b93', 100, 'Vaccin contre la grippe', 'Vaccin contre la grippe', '2024-11-10', NULL),
(376, '390906007', 101, 'Type 2 Diabetes Mellitus', 'Diagnostiquée le: 10/09/2025', '2025-09-10', NULL),
(377, '390906007', 101, 'Hypertension', 'Diagnostiquée le: 10/12/2018', '2018-12-10', NULL),
(378, '390906007', 102, 'Type 2 Diabetes Mellitus', 'Diagnostiquée le: 10/03/2025', '2025-03-10', NULL),
(379, '390906007', 102, 'Hypertension', 'Diagnostiquée le: 10/02/2018', '2018-02-10', NULL),
(380, 'RÉSUMÉ DES CONSULTATIONS', 103, 'Hypertension', 'Hypertension', '2014-09-10', NULL),
(381, 'RÉSUMÉ DES CONSULTATIONS', 103, 'Ostéoporose', 'Ostéoporose', NULL, NULL),
(382, 'RÉSUMÉ DES CONSULTATIONS', 103, 'Arthrose', 'Arthrose', NULL, NULL),
(383, '390906007', 104, 'Hypertension', 'Hypertension', '2015-05-10', NULL),
(384, '390906007', 104, 'Ostéoporose', 'Ostéoporose', NULL, NULL),
(385, '390906007', 104, 'Arthrose', 'Arthrose', NULL, NULL),
(386, '390906007', 104, 'Amlodipine 5 mg', 'Amlodipine 5 mg', '2015-06-06', NULL),
(387, '390906007', 104, 'Blood pressure: 120/71 mmHg', 'Blood pressure: 120/71 mmHg', '2025-07-10', NULL),
(388, '390906007', 104, 'Heart rate: 64 bpm', 'Heart rate: 64 bpm', '2025-07-10', NULL),
(389, '390906007', 104, 'Body temperature: 37.2 C', 'Body temperature: 37.2 C', '2025-07-10', NULL),
(390, '390906007', 104, 'Total cholesterol: 240 mg/dL', 'Total cholesterol: 240 mg/dL', '2025-07-10', NULL),
(391, '390906007', 104, 'Vaccin contre la grippe', 'Vaccin contre la grippe', '2024-11-10', NULL),
(392, '390906007', 104, 'Vaccin COVID-19 (rappel)', 'Vaccin COVID-19 (rappel)', '2024-07-10', NULL),
(393, '390906007', 104, 'Vaccin tétanos (rappel)', 'Vaccin tétanos (rappel)', '2020-11-10', NULL),
(394, '390906007', 104, 'Imagerie du 10 janvier 2025', 'Imagerie du 10 janvier 2025', '2025-01-10', NULL),
(395, '390906007', 104, 'Visite le 10 juillet 2025 à Inconnu', 'Visite le 10 juillet 2025 à Inconnu', '2025-07-10', NULL),
(396, 'Visite le 10 octobre 2024 à Inconnu', 105, 'HTA', 'Hypertension', '2020-10-10', NULL),
(397, 'Visite le 10 octobre 2024 à Inconnu', 105, 'AML', 'Amlodipine 5 mg', '2020-07-11', NULL),
(398, 'Visite le 10 octobre 2024 à Inconnu', 105, 'BP', 'Blood pressure', '2024-10-10', NULL),
(399, 'Visite le 10 octobre 2024 à Inconnu', 105, 'HR', 'Heart rate', '2024-10-10', NULL),
(400, 'Visite le 10 octobre 2024 à Inconnu', 105, 'BT', 'Body temperature', '2024-10-10', NULL),
(401, 'Visite le 10 octobre 2024 à Inconnu', 105, 'TC', 'Total cholesterol', '2024-10-10', NULL),
(402, 'Visite le 10 octobre 2024 à Inconnu', 105, 'FG', 'Vaccin contre la grippe', '2024-11-10', NULL),
(403, 'Visite le 10 octobre 2024 à Inconnu', 105, 'COVID', 'Vaccin COVID-19 (rappel)', '2024-07-10', NULL),
(404, '390906007', 106, 'Hypertension', 'Hypertension (Diagnostiquée le: 10/12/2020)', '2020-12-10', NULL),
(405, '390906007', 106, 'Amlodipine 5 mg', 'Amlodipine 5 mg [Du 10/12/2020 au En cours] (Actif)', '2020-12-10', NULL),
(406, '390906007', 106, 'Blood pressure: 119/80 mmHg', 'Blood pressure: 119/80 mmHg (Date: 10/05/2024)', '2024-05-10', '2024-05-10'),
(407, '390906007', 106, 'Heart rate: 87 bpm', 'Heart rate: 87 bpm (Date: 10/05/2024)', '2024-05-10', '2024-05-10'),
(408, '390906007', 106, 'Body temperature: 37.9 C', 'Body temperature: 37.9 C (Date: 10/05/2024)', '2024-05-10', '2024-05-10'),
(409, '390906007', 106, 'Total cholesterol: 180 mg/dL', 'Total cholesterol: 180 mg/dL (Date: 10/05/2024)', '2024-05-10', '2024-05-10'),
(410, '390906007', 106, 'Vaccin contre la grippe', 'Vaccin contre la grippe (Administré le: 10 novembre 2024)', '2024-11-10', '2024-11-10'),
(411, '390906007', 106, 'Imagerie du 10 mars 2025', 'Imagerie du 10 mars 2025, modalité: 366740001, site: 39607008', '2025-03-10', '2025-03-10'),
(412, '390906007', 106, 'Visite le 10 mai 2024', 'Visite le 10 mai 2024 à Inconnu (AMBULATORY, Code: 390906007) - Montant: 1 080 MAD', '2024-05-10', '2024-05-10'),
(413, '390906007', 107, 'E11', 'Type 2 Diabetes Mellitus', '2024-07-10', NULL),
(414, '390906007', 107, 'I10', 'Hypertension', '2016-02-10', NULL),
(415, 'Rapport médical non spécifié', 108, '390906007', 'WELLNESS', NULL, NULL),
(416, 'Rapport médical non spécifié', 108, NULL, 'Peanuts', NULL, NULL),
(417, 'Rapport médical non spécifié', 108, NULL, 'Human papillomavirus', NULL, NULL),
(418, 'Rapport médical non spécifié', 108, NULL, 'Tetanus, Diphtheria, Pertussis booster', NULL, NULL),
(419, '390906007', 110, 'Hypertension', 'Hypertension', '2014-02-10', NULL),
(420, '390906007', 110, 'Ostéoporose', 'Ostéoporose', NULL, NULL),
(421, '390906007', 110, 'Arthrose', 'Arthrose', NULL, NULL),
(422, '390906007', 110, 'Pneumococcal', 'Pneumococcal', '2024-04-10', NULL),
(423, '390906007', 111, 'Hypertension', 'Hypertension', '2016-08-10', NULL),
(424, '390906007', 111, 'Amlodipine 5 mg', 'Amlodipine 5 mg', '2024-03-10', NULL),
(425, '390906007', 111, 'Influenza', 'Influenza', '2023-04-10', NULL),
(426, '390906007', 111, 'Blood pressure: 95/97 mmHg', 'Blood pressure: 95/97 mmHg', '2025-10-10', NULL),
(427, '390906007', 111, 'Heart rate: 75 bpm', 'Heart rate: 75 bpm', '2025-10-10', NULL),
(428, '390906007', 111, 'Body temperature: 36.9 C', 'Body temperature: 36.9 C', '2025-10-10', NULL),
(429, '390906007', 111, 'Total cholesterol: 159 mg/dL', 'Total cholesterol: 159 mg/dL', '2025-10-10', NULL),
(430, '390906007', 112, 'Hypertension', 'Hypertension', '2022-12-10', NULL),
(431, '390906007', 112, 'Amlodipine 5 mg', 'Amlodipine 5 mg', '2022-12-11', NULL),
(432, '390906007', 112, 'Vaccin contre la grippe', 'Vaccin contre la grippe', '2024-11-10', NULL),
(433, '390906007', 112, 'Vaccin COVID-19 (rappel)', 'Vaccin COVID-19 (rappel)', '2024-07-10', NULL),
(434, '390906007', 112, 'Blood pressure: 95/69 mmHg', 'Blood pressure: 95/69 mmHg', '2025-04-10', NULL),
(435, '390906007', 112, 'Heart rate: 78 bpm', 'Heart rate: 78 bpm', '2025-04-10', NULL),
(436, '390906007', 112, 'Body temperature: 37.2 C', 'Body temperature: 37.2 C', '2025-04-10', NULL),
(437, '390906007', 112, 'Total cholesterol: 153 mg/dL', 'Total cholesterol: 153 mg/dL', '2025-04-10', NULL),
(438, '390906007', 113, 'Hypertension', 'Hypertension', '2017-12-10', NULL),
(439, '390906007', 113, 'Type 2 Diabetes Mellitus', 'Type 2 Diabetes Mellitus', '2025-07-10', NULL),
(440, '390906007', 114, 'Hypertension', 'Hypertension', '2014-06-10', NULL),
(441, '390906007', 114, 'Ramipril 5 mg', 'Ramipril 5 mg', '2025-02-10', NULL),
(442, '390906007', 114, 'Blood pressure: 114/94 mmHg', 'Blood pressure: 114/94 mmHg', '2024-04-10', NULL),
(443, '390906007', 114, 'Heart rate: 68 bpm', 'Heart rate: 68 bpm', '2024-04-10', NULL),
(444, '390906007', 114, 'Body temperature: 37.6 C', 'Body temperature: 37.6 C', '2024-04-10', NULL),
(445, '390906007', 114, 'Total cholesterol: 220 mg/dL', 'Total cholesterol: 220 mg/dL', '2024-04-10', NULL),
(446, '390906007', 114, 'Vaccin contre la grippe', 'Vaccin contre la grippe', '2024-11-10', NULL),
(447, '390906007', 115, 'Hypertension', 'Hypertension', '2007-11-10', NULL),
(448, '390906007', 115, 'Ostéoporose', 'Ostéoporose', NULL, NULL),
(449, '390906007', 115, 'Arthrose', 'Arthrose', NULL, NULL),
(450, '390906007', 115, 'Peanuts', 'Peanuts', '2012-11-10', NULL),
(451, '390906007', 115, 'Dairy', 'Dairy', '2015-11-10', NULL),
(452, '390906007', 115, 'Pneumococcal (elderly)', 'Pneumococcal (elderly)', '2025-07-10', NULL),
(453, '390906007', 116, 'Hypertension', 'Hypertension', '2019-10-10', NULL),
(454, '390906007', 116, 'Pneumococcal (elderly)', 'Pneumococcal (elderly)', '2023-06-10', NULL),
(455, '390906007', 116, 'Amlodipine 5 mg', 'Amlodipine 5 mg', '2025-07-10', NULL),
(456, '390906007', 116, 'Blood pressure: 117/80 mmHg', 'Blood pressure: 117/80 mmHg', '2025-09-10', NULL),
(457, '390906007', 116, 'Heart rate: 82 bpm', 'Heart rate: 82 bpm', '2025-09-10', NULL),
(458, '390906007', 116, 'Body temperature: 37.3 C', 'Body temperature: 37.3 C', '2025-09-10', NULL),
(459, '390906007', 116, 'Total cholesterol: 245 mg/dL', 'Total cholesterol: 245 mg/dL', '2025-09-10', NULL),
(460, '390906007', 116, 'Imagerie du 10 octobre 2025', 'Imagerie du 10 octobre 2025', '2025-10-10', NULL),
(461, '390906007', 117, 'Amlodipine 5 mg', 'Médicament', '2014-05-17', NULL),
(462, '390906007', 117, 'Hypertension', 'Pathologie', '2014-05-10', NULL),
(463, '390906007', 117, 'Vaccin contre la grippe', 'Vaccination', '2024-11-10', NULL),
(464, '390906007', 117, 'Blood pressure: 97/97 mmHg', 'Observation', '2025-04-10', NULL),
(465, '390906007', 117, 'Heart rate: 72 bpm', 'Observation', '2025-04-10', NULL),
(466, '390906007', 117, 'Body temperature: 37.5 C', 'Observation', '2025-04-10', NULL),
(467, '390906007', 117, 'Total cholesterol: 181 mg/dL', 'Observation', '2025-04-10', NULL),
(468, '390906007', 118, 'Hypertension', 'Hypertension', '2017-12-10', NULL),
(469, '390906007', 118, 'Amlodipine 5 mg', 'Amlodipine 5 mg', '2017-12-12', NULL),
(470, '390906007', 118, 'Influenza', 'Influenza', '2023-08-10', NULL),
(471, '390906007', 118, 'Blood pressure: 133/67 mmHg', 'Blood pressure: 133/67 mmHg', '2023-12-10', NULL),
(472, '390906007', 118, 'Heart rate: 95 bpm', 'Heart rate: 95 bpm', '2023-12-10', NULL),
(473, '390906007', 118, 'Body temperature: 36.5 C', 'Body temperature: 36.5 C', '2023-12-10', NULL),
(474, '390906007', 118, 'Total cholesterol: 214 mg/dL', 'Total cholesterol: 214 mg/dL', '2023-12-10', NULL),
(475, '17bf742b-8704-457e-8c08-5c6c484967bb', 119, 'Asthma', 'Asthma', '2006-04-10', NULL),
(476, '17bf742b-8704-457e-8c08-5c6c484967bb', 119, 'Hypertension', 'Hypertension', '2024-11-18', NULL),
(477, '17bf742b-8704-457e-8c08-5c6c484967bb', 119, 'Hypertension', 'Hypertension', '2024-11-10', NULL),
(478, 'consultation-2025-11-10', 120, NULL, 'Naissance', '2017-11-07', NULL),
(479, 'consultation-2025-11-10', 120, NULL, 'HTA chez le père', NULL, NULL),
(480, 'consultation-2025-11-10', 120, NULL, 'Diabète chez la mère', NULL, NULL),
(481, 'consultation-2025-11-10', 120, NULL, 'Allergie au latex', '2007-11-10', NULL),
(482, 'consultation-2025-11-10', 120, NULL, 'Allergie au pénicilline', '2021-11-10', NULL),
(483, 'consultation-2025-11-10', 120, NULL, 'Vaccin COVID-19 (rappel)', '2024-07-10', NULL),
(484, 'consultation-2025-11-10', 120, NULL, 'Vaccin contre la grippe', '2024-11-10', NULL),
(485, 'consultation-2025-11-10', 120, '390906007', 'Visite de wellness', '2025-11-10', NULL),
(486, 'e84fef72-c630-48ef-86e8-3e308d265984', 121, 'Hypertension', 'Hypertension', '2018-02-10', NULL),
(487, 'e84fef72-c630-48ef-86e8-3e308d265984', 121, 'Amlodipine 5 mg', 'Amlodipine 5 mg', '2018-03-03', NULL),
(488, 'e84fef72-c630-48ef-86e8-3e308d265984', 121, 'Blood pressure measurement', 'Blood pressure measurement', '2024-07-10', NULL),
(489, 'e84fef72-c630-48ef-86e8-3e308d265984', 121, 'Electrocardiogram', 'Electrocardiogram', '2024-11-10', NULL),
(490, 'e84fef72-c630-48ef-86e8-3e308d265984', 121, 'Vaccin contre la grippe', 'Vaccin contre la grippe', '2024-11-10', NULL),
(491, 'e84fef72-c630-48ef-86e8-3e308d265984', 121, 'Vaccin COVID-19 (rappel)', 'Vaccin COVID-19 (rappel)', '2024-07-10', NULL),
(492, 'e84fef72-c630-48ef-86e8-3e308d265984', 121, 'Imagerie', 'Imagerie', '2024-06-10', NULL),
(493, '390906007', 122, 'Hypertension', 'Hypertension', '2019-10-10', NULL),
(494, '390906007', 122, 'Peanuts', 'Allergie aux arachides', '2016-11-10', NULL),
(495, '390906007', 122, 'Eggs', 'Allergie aux œufs', '2016-11-10', NULL),
(496, '390906007', 122, 'Vaccin tétanos', 'Vaccin tétanos (rappel)', '2020-11-10', NULL),
(497, '390906007', 122, 'Vaccin COVID-19', 'Vaccin COVID-19 (rappel)', '2024-07-10', NULL),
(498, '390906007', 122, 'Vaccin contre la grippe', 'Vaccin contre la grippe', '2024-11-10', NULL),
(499, '390906007', 122, 'Blood pressure measurement', 'Mesure de la pression artérielle', '2025-01-10', NULL),
(500, '390906007', 122, 'Electrocardiogram', 'Électrocardiogramme', '2025-02-10', NULL),
(501, '390906007', 122, 'Blood pressure: 91/87 mmHg', 'Pression artérielle : 91/87 mmHg', '2024-03-10', NULL),
(502, '390906007', 122, 'Heart rate: 73 bpm', 'Frequance cardiaque : 73 bpm', '2024-03-10', NULL),
(503, '390906007', 122, 'Body temperature: 37.4 C', 'Température corporelle : 37.4 C', '2024-03-10', NULL),
(504, '390906007', 122, 'Blood pressure: 101/92 mmHg', 'Pression artérielle : 101/92 mmHg', '2025-11-10', NULL),
(505, '390906007', 122, 'Heart rate: 119 bpm', 'Frequance cardiaque : 119 bpm', '2025-11-10', NULL),
(506, '390906007', 122, 'Body temperature: 37.5 C', 'Température corporelle : 37.5 C', '2025-11-10', NULL),
(507, '390906007', 124, 'Hypertension', 'Hypertension', '2022-09-10', NULL),
(508, '390906007', 124, 'Type 2 Diabetes Mellitus', 'Type 2 Diabetes Mellitus', '2024-11-10', NULL),
(509, '390906007', 124, 'Metformin 500 mg', 'Metformin 500 mg', '2024-12-09', NULL),
(510, '390906007', 124, 'Amlodipine 5 mg', 'Amlodipine 5 mg', '2022-09-11', NULL),
(511, '390906007', 124, 'Vaccin contre la grippe', 'Vaccin contre la grippe', '2024-11-10', NULL),
(512, '390906007', 124, 'Vaccin COVID-19 (rappel)', 'Vaccin COVID-19 (rappel)', '2024-07-10', NULL),
(513, '390906007', 124, 'Imagerie', 'Imagerie', '2025-04-10', NULL),
(514, 'RÉSUMÉ DES CONSULTATIONS', 125, 'Ostéoporose', 'Diagnostiquée le: N/A', '2007-06-25', NULL),
(515, 'RÉSUMÉ DES CONSULTATIONS', 125, 'Arthrose', 'Diagnostiquée le: N/A', '2007-06-25', NULL),
(516, 'RÉSUMÉ DES CONSULTATIONS', 125, 'Hypertension', 'Diagnostiquée le: 2007-06-10', '2007-06-10', NULL),
(517, 'RÉSUMÉ DES CONSULTATIONS', 125, 'Allergie à la pénicilline', 'Identifiée le: 2009-11-10', '2009-11-10', NULL),
(518, 'RÉSUMÉ DES CONSULTATIONS', 125, 'Allergie aux arachides', 'Identifiée le: 2013-11-10', '2013-11-10', NULL),
(519, 'RÉSUMÉ DES CONSULTATIONS', 125, 'Vaccin tétanos (rappel)', 'Administré le: 2020-11-10', '2020-11-10', NULL),
(520, 'RÉSUMÉ DES CONSULTATIONS', 125, 'Vaccin COVID-19 (rappel)', 'Administré le: 2024-07-10', '2024-07-10', NULL),
(521, 'RÉSUMÉ DES CONSULTATIONS', 125, 'Vaccin contre la grippe', 'Administré le: 2024-11-10', '2024-11-10', NULL),
(522, 'RÉSUMÉ DES CONSULTATIONS', 125, 'Imagerie', 'Modalité: 366740001, site: 39607008', '2024-02-10', NULL),
(523, 'RÉSUMÉ DES CONSULTATIONS', 125, 'Consultation', 'Visite le 10 janvier 2025 à Inconnu (AMBULATORY, Code: 390906007)', '2025-01-10', NULL),
(524, '390906007', 126, 'HTA', 'Hypertension', '2022-08-10', NULL),
(525, '390906007', 126, 'Amlodipine', 'Amlodipine 5 mg', '2022-08-31', NULL),
(526, '390906007', 126, 'Blood pressure', 'Blood pressure: 116/88 mmHg', '2024-05-10', NULL),
(527, '390906007', 126, 'Heart rate', 'Heart rate: 88 bpm', '2024-05-10', NULL),
(528, '390906007', 126, 'Body temperature', 'Body temperature: 37.1 C', '2024-05-10', NULL),
(529, '390906007', 126, 'Total cholesterol', 'Total cholesterol: 194 mg/dL', '2024-05-10', NULL),
(530, '390906007', 126, 'Vaccin COVID-19 (rappel)', 'Vaccin COVID-19 (rappel)', '2024-07-10', NULL),
(531, '390906007', 126, 'Vaccin contre la grippe', 'Vaccin contre la grippe', '2024-11-10', NULL),
(532, '390906007', 126, 'Vaccin tétanos (rappel)', 'Vaccin tétanos (rappel)', '2020-11-10', NULL),
(533, '390906007', 126, '390906007', 'Visite le 10 mai 2024 à Inconnu (AMBULATORY)', '2024-05-10', NULL),
(534, 'RÉSUMÉ DES CONSULTATIONS', 127, 'Hypertension', 'Hypertension', '2007-09-10', NULL),
(535, 'RÉSUMÉ DES CONSULTATIONS', 127, 'Ostéoporose', 'Ostéoporose', NULL, NULL),
(536, 'RÉSUMÉ DES CONSULTATIONS', 127, 'Arthrose', 'Arthrose', NULL, NULL),
(537, '390906007', 128, 'HTA', 'Hypertension', '2019-04-10', NULL),
(538, '390906007', 128, 'Pneumococcal', 'Vaccination pneumococcale', '2024-10-10', NULL),
(539, '390906007', 128, 'Amlodipine', 'Traitement avec Amlodipine 5 mg', '2019-05-06', NULL),
(540, '390906007', 129, 'Amlodipine 5 mg', 'Médicament', '2016-10-26', NULL),
(541, '390906007', 129, 'Hypertension', 'Condition diagnostiquée', '2016-10-10', NULL),
(542, '390906007', 129, 'Vaccin contre la grippe', 'Vaccination', '2024-11-10', NULL),
(543, '390906007', 129, 'Vaccin COVID-19 (rappel)', 'Vaccination', '2024-07-10', NULL),
(544, '390906007', 130, 'Hypertension', 'Hypertension', '2018-10-10', NULL),
(545, '390906007', 130, 'Pneumococcal', 'Vaccination pneumococcale', '2024-11-10', NULL),
(546, '390906007', 130, 'Imagerie', 'Imagerie du 10 août 2024', '2024-08-10', NULL),
(547, '390906007', 131, 'Hypertension', 'Hypertension', '2017-06-10', NULL),
(548, '390906007', 131, 'Influenza', 'Influenza', '2023-07-10', NULL),
(549, '390906007', 132, 'Ostéoporose', 'Diagnostiquée le: N/A', '2014-11-28', NULL),
(550, '390906007', 132, 'Arthrose', 'Diagnostiquée le: N/A', '2014-11-28', NULL),
(551, '390906007', 132, 'Hypertension', 'Diagnostiquée le: 10/11/2014', '2014-11-10', NULL),
(552, '390906007', 133, 'Hypertension', 'Hypertension', '2014-12-10', NULL),
(553, '390906007', 133, 'Ostéoporose', 'Ostéoporose', NULL, NULL),
(554, '390906007', 133, 'Arthrose', 'Arthrose', NULL, NULL);
INSERT INTO `dim_condition` (`condition_id`, `encounter_id`, `patient_id`, `code`, `description`, `start_date`, `stop_date`) VALUES
(555, '390906007', 133, 'Bisoprolol 5 mg', 'Bisoprolol 5 mg', '2024-12-10', NULL),
(556, '390906007', 133, 'Blood pressure: 106/96 mmHg', 'Blood pressure: 106/96 mmHg', '2024-12-10', NULL),
(557, '390906007', 133, 'Heart rate: 88 bpm', 'Heart rate: 88 bpm', '2024-12-10', NULL),
(558, '390906007', 133, 'Body temperature: 37.5 C', 'Body temperature: 37.5 C', '2024-12-10', NULL),
(559, '390906007', 133, 'Total cholesterol: 163 mg/dL', 'Total cholesterol: 163 mg/dL', '2024-12-10', NULL),
(560, '390906007', 133, 'Influenza', 'Influenza', '2024-05-10', NULL),
(561, '390906007', 133, 'Pneumococcal (elderly)', 'Pneumococcal (elderly)', '2022-05-10', NULL),
(562, '390906007', 133, 'Imagerie', 'Imagerie', '2025-11-10', NULL),
(563, '1453a080-d31f-4507-b99f-461e3edf21d1', 134, 'HTA', 'Hypertension', '2020-07-10', NULL),
(564, '1453a080-d31f-4507-b99f-461e3edf21d1', 134, 'Amlodipine', 'Amlodipine 5 mg', '2020-07-28', NULL),
(565, '1453a080-d31f-4507-b99f-461e3edf21d1', 134, '366740001', 'Imagerie', '2024-01-10', NULL),
(566, '1453a080-d31f-4507-b99f-461e3edf21d1', 134, 'Vaccin contre la grippe', 'Vaccin contre la grippe', '2024-11-10', NULL),
(567, '1453a080-d31f-4507-b99f-461e3edf21d1', 134, 'Blood pressure measurement', 'Mesure de la pression artérielle', '2024-09-10', NULL),
(568, '1453a080-d31f-4507-b99f-461e3edf21d1', 134, 'Blood pressure: 105/60 mmHg', 'Pression artérielle : 105/60 mmHg', '2024-03-10', NULL),
(569, '1453a080-d31f-4507-b99f-461e3edf21d1', 134, 'Heart rate: 86 bpm', 'Frequance cardiaque : 86 bpm', '2024-03-10', NULL),
(570, '1453a080-d31f-4507-b99f-461e3edf21d1', 134, 'Body temperature: 37.8 C', 'Température corporelle : 37.8 C', '2024-03-10', NULL),
(571, '1453a080-d31f-4507-b99f-461e3edf21d1', 134, 'Blood pressure: 138/69 mmHg', 'Pression artérielle : 138/69 mmHg', '2025-11-10', NULL),
(572, '1453a080-d31f-4507-b99f-461e3edf21d1', 134, 'Heart rate: 109 bpm', 'Frequance cardiaque : 109 bpm', '2025-11-10', NULL),
(573, '1453a080-d31f-4507-b99f-461e3edf21d1', 134, 'Body temperature: 37.8 C', 'Température corporelle : 37.8 C', '2025-11-10', NULL),
(574, '1453a080-d31f-4507-b99f-461e3edf21d1', 134, '390906007', 'Visite à Hôpital Militaire d\'Instruction Mohammed V', '2025-11-10', NULL),
(575, '1453a080-d31f-4507-b99f-461e3edf21d1', 134, '390906007', 'Visite à Centre Hospitalier Universitaire Ibn Sina', '2025-11-10', NULL),
(576, '75910d8e-c0a0-4487-982d-8595d32a471e', 135, 'Hypertension', 'Hypertension', '2011-07-14', NULL),
(577, '75910d8e-c0a0-4487-982d-8595d32a471e', 135, 'Pneumococcal (elderly)', 'Pneumococcal (elderly)', '2021-11-10', NULL),
(578, '75910d8e-c0a0-4487-982d-8595d32a471e', 135, 'Blood pressure measurement', 'Blood pressure measurement', '2024-08-10', NULL),
(579, '75910d8e-c0a0-4487-982d-8595d32a471e', 135, 'Electrocardiogram', 'Electrocardiogram', '2024-08-10', NULL),
(580, '75910d8e-c0a0-4487-982d-8595d32a471e', 135, 'Imagerie', 'Imagerie', '2025-04-10', NULL),
(581, '75910d8e-c0a0-4487-982d-8595d32a471e', 135, 'WELLNESS', 'Visite le 10 novembre 2025 à Clinique Les Orangers', '2025-11-10', NULL),
(582, '75910d8e-c0a0-4487-982d-8595d32a471e', 135, 'AMBULATORY', 'Visite le 10 novembre 2025 à Centre Hospitalier Universitaire Ibn Sina', '2025-11-10', NULL),
(583, 'RÉSUMÉ DES CONSULTATIONS', 136, 'Hypertension', 'Hypertension', '2012-09-10', NULL),
(584, 'RÉSUMÉ DES CONSULTATIONS', 136, 'Ostéoporose', 'Ostéoporose', NULL, NULL),
(585, 'RÉSUMÉ DES CONSULTATIONS', 136, 'Arthrose', 'Arthrose', NULL, NULL),
(586, 'RÉSUMÉ DES CONSULTATIONS', 136, 'Influenza', 'Influenza', '2022-09-10', NULL),
(587, 'RÉSUMÉ DES CONSULTATIONS', 136, 'Pneumococcal', 'Pneumococcal', '2023-12-10', NULL),
(588, 'RÉSUMÉ DES CONSULTATIONS', 137, 'Asthma', 'Asthma (Diagnostiquée le: 10/11/2017)', '2017-11-10', NULL),
(589, 'RÉSUMÉ DES CONSULTATIONS', 137, 'Salbutamol 100 mcg inhaler', 'Salbutamol 100 mcg inhaler [Du 10/04/2025 au En cours] (Actif)', '2025-04-10', NULL),
(590, 'RÉSUMÉ DES CONSULTATIONS', 137, 'Vaccin contre la grippe', 'Vaccin contre la grippe (Administré le: 10 novembre 2024)', '2024-11-10', NULL),
(591, 'RÉSUMÉ DES CONSULTATIONS', 137, 'Vaccin COVID-19 (rappel)', 'Vaccin COVID-19 (rappel) (Administré le: 10 juillet 2024)', '2024-07-10', NULL),
(592, 'RÉSUMÉ DES CONSULTATIONS', 137, 'Vaccin tétanos (rappel)', 'Vaccin tétanos (rappel) (Administré le: 10 novembre 2020)', '2020-11-10', NULL),
(593, 'RÉSUMÉ DES CONSULTATIONS', 137, 'Imagerie du 10 juin 2025', 'Imagerie du 10 juin 2025, modalité: 366740001, site: 39607008', '2025-06-10', NULL),
(594, '390906007', 138, 'Hypertension', 'Hypertension', '2021-12-10', NULL),
(595, '390906007', 138, 'Amlodipine 5 mg', 'Amlodipine 5 mg', '2022-01-04', NULL),
(596, '390906007', 138, 'Pneumococcal', 'Pneumococcal', '2021-12-10', NULL),
(597, '390906007', 138, 'Blood pressure: 92/81 mmHg', 'Blood pressure: 92/81 mmHg', '2024-07-10', NULL),
(598, '390906007', 138, 'Heart rate: 86 bpm', 'Heart rate: 86 bpm', '2024-07-10', NULL),
(599, '390906007', 138, 'Body temperature: 37.0 C', 'Body temperature: 37.0 C', '2024-07-10', NULL),
(600, '390906007', 138, 'Total cholesterol: 213 mg/dL', 'Total cholesterol: 213 mg/dL', '2024-07-10', NULL),
(601, '390906007', 139, 'Amlodipine 5 mg', 'Médicament', '2020-05-14', NULL),
(602, '390906007', 139, 'Hypertension', 'Pathologie', '2020-05-10', NULL),
(603, '390906007', 139, 'Vaccin contre la grippe', 'Vaccination', '2024-11-10', NULL),
(604, '390906007', 139, 'Imagerie', 'Étude d\'imagerie', '2025-10-10', NULL),
(605, '390906007', 139, 'Blood pressure: 103/79 mmHg', 'Observation clé', '2025-03-10', NULL),
(606, '390906007', 139, 'Heart rate: 63 bpm', 'Observation clé', '2025-03-10', NULL),
(607, '390906007', 139, 'Body temperature: 36.9 C', 'Observation clé', '2025-03-10', NULL),
(608, '390906007', 139, 'Total cholesterol: 175 mg/dL', 'Observation clé', '2025-03-10', NULL),
(609, '390906007', 140, 'Hypertension', 'Hypertension', '2019-12-10', NULL),
(610, '390906007', 140, 'Bisoprolol 5 mg', 'Bisoprolol 5 mg', '2025-03-10', NULL),
(611, '390906007', 140, 'Influenza', 'Influenza', '2024-10-10', NULL),
(612, '390906007', 140, 'Imagerie', 'Imagerie', '2024-11-10', NULL);

-- --------------------------------------------------------

--
-- Structure de la table `dim_date`
--

CREATE TABLE `dim_date` (
  `date_id` date NOT NULL,
  `year` int(11) DEFAULT NULL,
  `month` int(11) DEFAULT NULL,
  `month_name` varchar(20) DEFAULT NULL,
  `quarter` int(11) DEFAULT NULL,
  `day_of_month` int(11) DEFAULT NULL,
  `day_of_week` int(11) DEFAULT NULL,
  `day_name` varchar(20) DEFAULT NULL,
  `is_weekend` tinyint(1) DEFAULT NULL
) ENGINE=InnoDB DEFAULT CHARSET=utf8mb4 COLLATE=utf8mb4_general_ci;

--
-- Déchargement des données de la table `dim_date`
--

INSERT INTO `dim_date` (`date_id`, `year`, `month`, `month_name`, `quarter`, `day_of_month`, `day_of_week`, `day_name`, `is_weekend`) VALUES
('2023-12-10', 2023, 12, 'December', 4, 10, 1, 'Sunday', 1),
('2024-03-10', 2024, 3, 'March', 1, 10, 1, 'Sunday', 1),
('2024-07-10', 2024, 7, 'July', 3, 10, 4, 'Wednesday', 0),
('2024-09-10', 2024, 9, 'September', 3, 10, 3, 'Tuesday', 0),
('2024-10-10', 2024, 10, 'October', 4, 10, 5, 'Thursday', 0),
('2024-11-10', 2024, 11, 'November', 4, 10, 1, 'Sunday', 1),
('2025-01-10', 2025, 1, 'January', 1, 10, 6, 'Friday', 0),
('2025-02-10', 2025, 2, 'February', 1, 10, 2, 'Monday', 0),
('2025-05-10', 2025, 5, 'May', 2, 10, 7, 'Saturday', 1),
('2025-07-10', 2025, 7, 'July', 3, 10, 5, 'Thursday', 0),
('2025-11-10', 2025, 11, 'November', 4, 10, 2, 'Monday', 0);

-- --------------------------------------------------------

--
-- Structure de la table `dim_immunization`
--

CREATE TABLE `dim_immunization` (
  `immunization_id` int(11) NOT NULL,
  `encounter_id` varchar(36) DEFAULT NULL,
  `patient_id` int(11) DEFAULT NULL,
  `code` varchar(50) DEFAULT NULL,
  `description` text DEFAULT NULL,
  `date_administered` date DEFAULT NULL,
  `base_cost` decimal(12,2) DEFAULT NULL
) ENGINE=InnoDB DEFAULT CHARSET=utf8mb4 COLLATE=utf8mb4_general_ci;

--
-- Déchargement des données de la table `dim_immunization`
--

INSERT INTO `dim_immunization` (`immunization_id`, `encounter_id`, `patient_id`, `code`, `description`, `date_administered`, `base_cost`) VALUES
(1, '390906007', 3, 'Influenza', 'Influenza', '2022-08-10', NULL),
(2, '390906007', 3, 'Influenza', 'Influenza', '2022-08-10', NULL),
(3, '390906007', 4, 'Vaccin contre la grippe', 'Vaccin contre la grippe', '2024-11-10', NULL),
(4, '390906007', 4, 'Vaccin COVID-19 (rappel)', 'Vaccin COVID-19 (rappel)', '2024-07-10', NULL),
(5, '390906007', 5, 'Pneumococcal', 'Pneumococcal', '2025-09-10', NULL),
(6, '390906007', 6, 'Pneumococcal', 'Pneumococcal', '2025-04-10', NULL),
(7, 'RÉSUMÉ DES CONSULTATIONS', 8, 'Vaccin contre la grippe', 'Vaccin contre la grippe', '2024-11-10', NULL),
(8, 'RÉSUMÉ DES CONSULTATIONS', 8, 'Vaccin COVID-19 (rappel)', 'Vaccin COVID-19 (rappel)', '2024-07-10', NULL),
(9, '390906007', 9, 'Influenza', 'Influenza', '2023-03-10', NULL),
(10, '390906007', 17, 'Vaccin contre la grippe', 'Vaccin contre la grippe', '2024-11-10', NULL),
(11, '390906007', 17, 'Vaccin COVID-19 (rappel)', 'Vaccin COVID-19 (rappel)', '2024-07-10', NULL),
(12, '390906007', 17, 'Vaccin tétanos (rappel)', 'Vaccin tétanos (rappel)', '2020-11-10', NULL),
(13, '390906007', 26, 'Influenza', 'Influenza', '2021-10-10', NULL),
(14, '390906007', 26, 'Pneumococcal', 'Pneumococcal', '2025-07-10', NULL),
(15, '390906007', 28, 'Vaccin contre la grippe', 'Vaccin contre la grippe', '2024-11-10', NULL),
(16, '390906007', 28, 'Vaccin COVID-19 (rappel)', 'Vaccin COVID-19 (rappel)', '2024-07-10', NULL),
(17, '390906007', 28, 'Vaccin tétanos (rappel)', 'Vaccin tétanos (rappel)', '2020-11-10', NULL),
(18, 'RÉSUMÉ DES CONSULTATIONS', 29, 'Influenza', 'Influenza', '2024-09-10', NULL),
(19, '390906007', 30, 'Pneumococcal (elderly)', 'Pneumococcal (elderly)', '2025-06-10', NULL),
(20, '390906007', 32, 'Influenza', 'Influenza', '2025-01-10', NULL),
(21, '390906007', 33, 'Pneumococcal (elderly)', 'Pneumococcal (elderly)', '2023-09-10', NULL),
(22, 'Visite le 10 mai 2025 à Inconnu', 35, 'Pneumococcal', 'Pneumococcal', '2025-06-10', NULL),
(23, '01f0378a-80a5-4dd3-8094-afa971205da1', 36, 'Vaccin contre la grippe', 'Vaccin contre la grippe', '2024-11-10', NULL),
(24, '01f0378a-80a5-4dd3-8094-afa971205da1', 36, 'Vaccin COVID-19 (rappel)', 'Vaccin COVID-19 (rappel)', '2024-07-10', NULL),
(25, '01f0378a-80a5-4dd3-8094-afa971205da1', 36, 'Vaccin tétanos (rappel)', 'Vaccin tétanos (rappel)', '2020-11-10', NULL),
(26, '390906007', 38, 'Influenza', 'Influenza', '2023-01-10', NULL),
(27, '390906007', 38, 'Pneumococcal (elderly)', 'Pneumococcal (elderly)', '2025-04-10', NULL),
(28, '390906007', 42, 'Vaccin contre la grippe', 'Vaccin contre la grippe', '2024-11-10', NULL),
(29, '390906007', 42, 'Vaccin COVID-19 (rappel)', 'Vaccin COVID-19 (rappel)', '2024-07-10', NULL),
(30, '390906007', 42, 'Vaccin tétanos (rappel)', 'Vaccin tétanos (rappel)', '2020-11-10', NULL),
(31, '390906007', 45, 'Vaccin contre la grippe', 'Vaccin contre la grippe', '2024-11-10', NULL),
(32, '390906007', 45, 'Vaccin COVID-19 (rappel)', 'Vaccin COVID-19 (rappel)', '2024-07-10', NULL),
(33, '390906007', 45, 'Vaccin tétanos (rappel)', 'Vaccin tétanos (rappel)', '2020-11-10', NULL),
(34, '390906007', 46, 'Pneumococcal (elderly)', 'Pneumococcal (elderly)', '2025-07-10', NULL),
(35, '390906007', 47, 'Influenza', 'Influenza', '2021-04-10', NULL),
(36, '390906007', 48, 'Pneumococcal (elderly)', 'Pneumococcal (elderly)', '2022-02-10', NULL),
(37, '390906007', 49, 'Vaccin contre la grippe', 'Vaccin contre la grippe', '2024-11-10', NULL),
(38, '390906007', 49, 'Vaccin COVID-19 (rappel)', 'Vaccin COVID-19 (rappel)', '2024-07-10', NULL),
(39, '390906007', 50, 'Pneumococcal', 'Pneumococcal', '2024-10-10', NULL),
(40, '390906007', 51, 'Pneumococcal (elderly)', 'Pneumococcal (elderly)', '2021-01-10', NULL),
(41, '390906007', 52, 'Influenza', 'Influenza', '2022-04-10', NULL),
(42, '390906007', 52, 'Pneumococcal', 'Pneumococcal', '2024-01-10', NULL),
(43, '390906007', 53, 'Pneumococcal (elderly)', 'Pneumococcal (elderly)', '2021-08-10', NULL),
(44, '390906007', 54, 'Influenza', 'Influenza', '2024-01-10', NULL),
(45, '390906007', 54, 'Pneumococcal (elderly)', 'Pneumococcal (elderly)', '2022-01-10', NULL),
(46, 'RÉSUMÉ DES CONSULTATIONS', 58, 'Vaccin contre la grippe', 'Vaccin contre la grippe', '2024-11-10', NULL),
(47, 'RÉSUMÉ DES CONSULTATIONS', 58, 'Vaccin COVID-19 (rappel)', 'Vaccin COVID-19 (rappel)', '2024-07-10', NULL),
(48, 'RÉSUMÉ DES CONSULTATIONS', 58, 'Vaccin tétanos (rappel)', 'Vaccin tétanos (rappel)', '2020-11-10', NULL),
(49, '390906007', 59, 'Influenza', 'Influenza', '2021-10-10', NULL),
(50, '390906007', 62, 'Influenza', 'Influenza', '2021-04-10', NULL),
(51, '390906007', 62, 'Pneumococcal', 'Pneumococcal', '2025-11-10', NULL),
(52, 'RÉSUMÉ DES CONSULTATIONS', 63, 'Vaccin contre la grippe', 'Vaccin contre la grippe', '2024-11-10', NULL),
(53, '390906007', 64, 'Vaccin contre la grippe', 'Vaccin contre la grippe', '2024-11-10', NULL),
(54, '390906007', 65, 'Influenza', 'Influenza', '2024-06-10', NULL),
(55, '390906007', 65, 'Pneumococcal', 'Pneumococcal', '2024-06-10', NULL),
(56, '390906007', 66, 'Pneumococcal (elderly)', 'Pneumococcal (elderly)', '2025-10-10', NULL),
(57, 'RÉSUMÉ DES CONSULTATIONS', 67, 'Vaccin contre la grippe', 'Vaccin contre la grippe', '2024-11-10', NULL),
(58, 'RÉSUMÉ DES CONSULTATIONS', 67, 'Vaccin COVID-19 (rappel)', 'Vaccin COVID-19 (rappel)', '2024-07-10', NULL),
(59, '390906007', 68, 'Pneumococcal', 'Pneumococcal', '2025-09-10', NULL),
(60, '390906007', 68, 'Pneumococcal (elderly)', 'Pneumococcal (elderly)', '2025-10-10', NULL),
(61, '390906007', 69, 'Pneumococcal', 'Pneumococcal', '2021-10-10', NULL),
(62, '390906007', 69, 'Pneumococcal (elderly)', 'Pneumococcal (elderly)', '2025-07-10', NULL),
(63, '390906007', 70, 'Vaccin contre la grippe', 'Vaccin contre la grippe', '2024-11-10', NULL),
(64, '390906007', 70, 'Vaccin COVID-19 (rappel)', 'Vaccin COVID-19 (rappel)', '2024-07-10', NULL),
(65, '390906007', 70, 'Vaccin tétanos (rappel)', 'Vaccin tétanos (rappel)', '2020-11-10', NULL),
(66, '376af3da-1969-4bc6-947f-4b5d2be7b439', 71, 'Influenza', 'Influenza', '2025-03-10', NULL),
(67, '376af3da-1969-4bc6-947f-4b5d2be7b439', 71, 'Pneumococcal (elderly)', 'Pneumococcal (elderly)', '2023-08-10', NULL),
(68, '390906007', 75, 'Pneumococcal (elderly)', 'Pneumococcal (elderly)', '2021-07-10', NULL),
(69, 'RÉSUMÉ DES CONSULTATIONS', 77, 'Vaccin contre la grippe', 'Vaccin contre la grippe', '2024-11-10', NULL),
(70, 'RÉSUMÉ DES CONSULTATIONS', 77, 'Vaccin COVID-19 (rappel)', 'Vaccin COVID-19 (rappel)', '2024-07-10', NULL),
(71, 'RÉSUMÉ DES CONSULTATIONS', 77, 'Vaccin tétanos (rappel)', 'Vaccin tétanos (rappel)', '2020-11-10', NULL),
(72, '390906007', 79, 'Influenza', 'Influenza', '2023-06-10', NULL),
(73, '390906007', 80, 'Vaccin contre la grippe', 'Vaccin contre la grippe', '2024-11-10', NULL),
(74, '390906007', 80, 'Vaccin COVID-19 (rappel)', 'Vaccin COVID-19 (rappel)', '2024-07-10', NULL),
(75, '390906007', 80, 'Vaccin tétanos (rappel)', 'Vaccin tétanos (rappel)', '2020-11-10', NULL),
(76, '390906007', 82, 'Influenza', 'Influenza', '2024-04-10', NULL),
(77, '390906007', 83, 'Vaccin contre la grippe', 'Vaccin contre la grippe', '2024-11-10', NULL),
(78, '390906007', 83, 'Vaccin COVID-19 (rappel)', 'Vaccin COVID-19 (rappel)', '2024-07-10', NULL),
(79, '390906007', 83, 'Vaccin tétanos (rappel)', 'Vaccin tétanos (rappel)', '2020-11-10', NULL),
(80, 'fcd411f5-6cf4-46ce-aa34-efabee789c5c', 85, 'Vaccin contre la grippe', 'Vaccin contre la grippe', '2024-11-10', NULL),
(81, 'fcd411f5-6cf4-46ce-aa34-efabee789c5c', 85, 'Vaccin COVID-19 (rappel)', 'Vaccin COVID-19 (rappel)', '2024-07-10', NULL),
(82, 'Visite le 10 novembre 2025 à Inconnu', 86, 'Vaccin contre la grippe', 'Vaccin contre la grippe', '2024-11-10', NULL),
(83, '390906007', 87, 'Influenza', 'Influenza', '2024-06-10', NULL),
(84, '390906007', 88, 'Vaccin contre la grippe', 'Vaccin contre la grippe', '2024-11-10', NULL),
(85, '390906007', 89, 'Vaccin contre la grippe', 'Vaccin contre la grippe', '2024-11-10', NULL),
(86, '390906007', 89, 'Vaccin COVID-19 (rappel)', 'Vaccin COVID-19 (rappel)', '2024-07-10', NULL),
(87, '390906007', 90, 'Pneumococcal', 'Pneumococcal', '2023-11-10', NULL),
(88, '390906007', 91, 'Vaccin contre la grippe', 'Vaccin contre la grippe', '2024-11-10', NULL),
(89, '390906007', 92, 'Vaccin contre la grippe', 'Vaccin contre la grippe', '2024-11-10', NULL),
(90, '390906007', 92, 'Vaccin COVID-19 (rappel)', 'Vaccin COVID-19 (rappel)', '2024-07-10', NULL),
(91, 'RÉSUMÉ DES CONSULTATIONS', 93, 'Vaccin contre la grippe', 'Vaccin contre la grippe', '2024-11-10', NULL),
(92, 'RÉSUMÉ DES CONSULTATIONS', 93, 'Vaccin COVID-19 (rappel)', 'Vaccin COVID-19 (rappel)', '2024-07-10', NULL),
(93, 'RÉSUMÉ DES CONSULTATIONS', 93, 'Vaccin tétanos (rappel)', 'Vaccin tétanos (rappel)', '2020-11-10', NULL),
(94, '390906007', 94, 'Pneumococcal', 'Pneumococcal', '2025-01-10', NULL),
(95, '390906007', 95, 'Influenza', 'Influenza', '2024-09-10', NULL),
(96, '390906007', 95, 'Pneumococcal', 'Pneumococcal', '2021-09-10', NULL),
(97, '390906007', 95, 'Pneumococcal (elderly)', 'Pneumococcal (elderly)', '2022-05-10', NULL),
(98, 'ca995412-7cbb-401a-97b1-fb6d3324487b', 97, 'Vaccin contre la grippe', 'Vaccin contre la grippe', '2024-11-10', NULL),
(99, 'ca995412-7cbb-401a-97b1-fb6d3324487b', 97, 'Vaccin COVID-19 (rappel)', 'Vaccin COVID-19 (rappel)', '2024-07-10', NULL),
(100, 'ca995412-7cbb-401a-97b1-fb6d3324487b', 97, 'Vaccin tétanos (rappel)', 'Vaccin tétanos (rappel)', '2020-11-10', NULL),
(101, '390906007', 98, 'Vaccin contre la grippe', 'Vaccin contre la grippe', '2024-11-10', NULL),
(102, '390906007', 98, 'Vaccin COVID-19 (rappel)', 'Vaccin COVID-19 (rappel)', '2024-07-10', NULL),
(103, '390906007', 99, 'Vaccin contre la grippe', 'Vaccin contre la grippe', '2024-11-10', NULL),
(104, '390906007', 99, 'Vaccin COVID-19 (rappel)', 'Vaccin COVID-19 (rappel)', '2024-07-10', NULL),
(105, '9e6faf9f-38b6-446b-ab88-8825558a5b93', 100, 'Vaccin contre la grippe', 'Vaccin contre la grippe', '2024-11-10', NULL),
(106, '390906007', 101, 'Vaccin contre la grippe', 'Vaccin contre la grippe', '2024-11-10', NULL),
(107, '390906007', 101, 'Vaccin COVID-19 (rappel)', 'Vaccin COVID-19 (rappel)', '2024-07-10', NULL),
(108, '390906007', 102, 'Influenza', 'Influenza', '2023-12-10', NULL),
(109, '390906007', 102, 'Pneumococcal (elderly)', 'Pneumococcal (elderly)', '2022-12-10', NULL),
(110, 'RÉSUMÉ DES CONSULTATIONS', 103, 'Pneumococcal', 'Pneumococcal', '2021-04-10', NULL),
(111, '390906007', 104, 'Vaccin contre la grippe', 'Vaccin contre la grippe', '2024-11-10', NULL),
(112, '390906007', 104, 'Vaccin COVID-19 (rappel)', 'Vaccin COVID-19 (rappel)', '2024-07-10', NULL),
(113, '390906007', 104, 'Vaccin tétanos (rappel)', 'Vaccin tétanos (rappel)', '2020-11-10', NULL),
(114, 'Visite le 10 octobre 2024 à Inconnu', 105, 'Vaccin contre la grippe', 'Vaccin contre la grippe', '2024-11-10', NULL),
(115, 'Visite le 10 octobre 2024 à Inconnu', 105, 'Vaccin COVID-19 (rappel)', 'Vaccin COVID-19 (rappel)', '2024-07-10', NULL),
(116, '390906007', 106, 'Vaccin contre la grippe', 'Vaccin contre la grippe', '2024-11-10', NULL),
(117, '390906007', 107, 'Vaccin contre la grippe', 'Vaccin contre la grippe', '2024-11-10', NULL),
(118, '390906007', 107, 'Vaccin COVID-19 (rappel)', 'Vaccin COVID-19 (rappel)', '2024-07-10', NULL),
(119, '390906007', 107, 'Vaccin tétanos (rappel)', 'Vaccin tétanos (rappel)', '2020-11-10', NULL),
(120, 'Rapport médical non spécifié', 108, 'Human papillomavirus', 'Human papillomavirus', '2021-01-10', NULL),
(121, 'Rapport médical non spécifié', 108, 'Tetanus, Diphtheria, Pertussis booster', 'Tetanus, Diphtheria, Pertussis booster', '2025-06-10', NULL),
(122, '390906007', 110, 'Pneumococcal', 'Pneumococcal', '2025-06-10', NULL),
(123, '390906007', 111, 'Influenza', 'Influenza', '2023-04-10', NULL),
(124, '390906007', 112, 'Vaccin contre la grippe', 'Vaccin contre la grippe', '2024-11-10', NULL),
(125, '390906007', 112, 'Vaccin COVID-19 (rappel)', 'Vaccin COVID-19 (rappel)', '2024-07-10', NULL),
(126, '390906007', 113, 'Vaccin contre la grippe', 'Vaccin contre la grippe', '2024-11-10', NULL),
(127, '390906007', 114, 'Vaccin contre la grippe', 'Vaccin contre la grippe', '2024-11-10', NULL),
(128, '390906007', 115, 'Pneumococcal (elderly)', 'Pneumococcal (elderly)', '2025-07-10', NULL),
(129, '390906007', 116, 'Pneumococcal (elderly)', 'Pneumococcal (elderly)', '2023-06-10', NULL),
(130, '390906007', 117, 'Vaccin contre la grippe', 'Vaccin contre la grippe', '2024-11-10', NULL),
(131, '390906007', 118, 'Influenza', 'Influenza', '2023-08-10', NULL),
(132, '17bf742b-8704-457e-8c08-5c6c484967bb', 119, 'Vaccin contre la grippe', 'Vaccin contre la grippe', '2024-11-10', NULL),
(133, '17bf742b-8704-457e-8c08-5c6c484967bb', 119, 'Vaccin COVID-19 (rappel)', 'Vaccin COVID-19 (rappel)', '2024-07-10', NULL),
(134, '17bf742b-8704-457e-8c08-5c6c484967bb', 119, 'Vaccin tétanos (rappel)', 'Vaccin tétanos (rappel)', '2020-11-10', NULL),
(135, 'consultation-2025-11-10', 120, 'Vaccin contre la grippe', 'Vaccin contre la grippe', '2024-11-10', NULL),
(136, 'consultation-2025-11-10', 120, 'Vaccin COVID-19 (rappel)', 'Vaccin COVID-19 (rappel)', '2024-07-10', NULL),
(137, 'e84fef72-c630-48ef-86e8-3e308d265984', 121, 'Vaccin COVID-19 (rappel)', 'Vaccin contre la grippe', '2024-07-10', NULL),
(138, 'e84fef72-c630-48ef-86e8-3e308d265984', 121, 'Vaccin contre la grippe', 'Vaccin contre la grippe', '2024-11-10', NULL),
(139, '390906007', 122, NULL, 'Vaccin contre la grippe', '2024-11-10', NULL),
(140, '390906007', 122, NULL, 'Vaccin COVID-19 (rappel)', '2024-07-10', NULL),
(141, '390906007', 122, NULL, 'Vaccin tétanos (rappel)', '2020-11-10', NULL),
(142, '390906007', 124, 'Vaccin contre la grippe', 'Vaccin contre la grippe', '2024-11-10', NULL),
(143, '390906007', 124, 'Vaccin COVID-19 (rappel)', 'Vaccin COVID-19 (rappel)', '2024-07-10', NULL),
(144, 'RÉSUMÉ DES CONSULTATIONS', 125, 'Vaccin contre la grippe', 'Vaccin contre la grippe', '2024-11-10', NULL),
(145, 'RÉSUMÉ DES CONSULTATIONS', 125, 'Vaccin COVID-19 (rappel)', 'Vaccin COVID-19 (rappel)', '2024-07-10', NULL),
(146, 'RÉSUMÉ DES CONSULTATIONS', 125, 'Vaccin tétanos (rappel)', 'Vaccin tétanos (rappel)', '2020-11-10', NULL),
(147, '390906007', 126, 'Vaccin contre la grippe', 'Vaccin contre la grippe', '2024-11-10', NULL),
(148, '390906007', 126, 'Vaccin COVID-19 (rappel)', 'Vaccin COVID-19 (rappel)', '2024-07-10', NULL),
(149, '390906007', 126, 'Vaccin tétanos (rappel)', 'Vaccin tétanos (rappel)', '2020-11-10', NULL),
(150, 'RÉSUMÉ DES CONSULTATIONS', 127, 'Vaccin contre la grippe', 'Vaccin contre la grippe', '2024-11-10', NULL),
(151, '390906007', 128, 'Pneumococcal', 'Pneumococcal', '2024-10-10', NULL),
(152, '390906007', 129, 'Vaccin contre la grippe', 'Vaccin contre la grippe', '2024-11-10', NULL),
(153, '390906007', 129, 'Vaccin COVID-19 (rappel)', 'Vaccin COVID-19 (rappel)', '2024-07-10', NULL),
(154, '390906007', 130, 'Pneumococcal', 'Pneumococcal', '2025-11-10', NULL),
(155, '390906007', 131, 'Influenza', 'Influenza', '2023-07-10', NULL),
(156, '390906007', 132, 'Vaccin contre la grippe', 'Vaccin contre la grippe', '2024-11-10', NULL),
(157, '390906007', 132, 'Vaccin COVID-19 (rappel)', 'Vaccin COVID-19 (rappel)', '2024-07-10', NULL),
(158, '390906007', 132, 'Vaccin tétanos (rappel)', 'Vaccin tétanos (rappel)', '2020-11-10', NULL),
(159, '390906007', 133, 'Influenza', 'Influenza', '2024-05-10', NULL),
(160, '390906007', 133, 'Pneumococcal (elderly)', 'Pneumococcal (elderly)', '2022-05-10', NULL),
(161, '1453a080-d31f-4507-b99f-461e3edf21d1', 134, 'Vaccin contre la grippe', 'Vaccin contre la grippe', '2024-11-10', NULL),
(162, '75910d8e-c0a0-4487-982d-8595d32a471e', 135, 'Pneumococcal (elderly)', 'Pneumococcal (elderly)', '2021-11-10', NULL),
(163, 'RÉSUMÉ DES CONSULTATIONS', 136, 'Influenza', 'Influenza', '2022-09-10', NULL),
(164, 'RÉSUMÉ DES CONSULTATIONS', 136, 'Pneumococcal', 'Pneumococcal', '2023-12-10', NULL),
(165, 'RÉSUMÉ DES CONSULTATIONS', 137, 'Vaccin contre la grippe', 'Vaccin contre la grippe', '2024-11-10', NULL),
(166, 'RÉSUMÉ DES CONSULTATIONS', 137, 'Vaccin COVID-19 (rappel)', 'Vaccin COVID-19 (rappel)', '2024-07-10', NULL),
(167, 'RÉSUMÉ DES CONSULTATIONS', 137, 'Vaccin tétanos (rappel)', 'Vaccin tétanos (rappel)', '2020-11-10', NULL),
(168, '390906007', 138, 'Pneumococcal', 'Pneumococcal', '2021-12-10', NULL),
(169, '390906007', 139, 'Vaccin contre la grippe', 'Vaccin contre la grippe', '2024-11-10', NULL);

-- --------------------------------------------------------

--
-- Structure de la table `dim_medication`
--

CREATE TABLE `dim_medication` (
  `medication_id` int(11) NOT NULL,
  `encounter_id` varchar(36) DEFAULT NULL,
  `patient_id` int(11) DEFAULT NULL,
  `code` varchar(50) DEFAULT NULL,
  `description` text DEFAULT NULL,
  `start_date` datetime DEFAULT NULL,
  `stop_date` datetime DEFAULT NULL,
  `base_cost` decimal(12,2) DEFAULT NULL,
  `total_cost` decimal(12,2) DEFAULT NULL,
  `payer_coverage` decimal(12,2) DEFAULT NULL
) ENGINE=InnoDB DEFAULT CHARSET=utf8mb4 COLLATE=utf8mb4_general_ci;

--
-- Déchargement des données de la table `dim_medication`
--

INSERT INTO `dim_medication` (`medication_id`, `encounter_id`, `patient_id`, `code`, `description`, `start_date`, `stop_date`, `base_cost`, `total_cost`, `payer_coverage`) VALUES
(1, '390906007', 3, 'Amlodipine 5 mg', 'Traitement de la hypertension', '2016-03-10 00:00:00', NULL, 0.00, 0.00, 0.00),
(2, '390906007', 4, 'Ramipril 5 mg', 'Du 10/09/2025 au En cours', '2025-09-10 00:00:00', NULL, NULL, NULL, NULL),
(3, '390906007', 3, 'Amlodipine 5 mg', 'Traitement de la hypertension', '2016-03-10 00:00:00', NULL, 0.00, 0.00, 0.00),
(4, '390906007', 4, 'Ramipril 5 mg', 'Du 10/09/2025 au En cours', NULL, NULL, NULL, NULL, NULL),
(5, '390906007', 5, 'Amlodipine 5 mg', 'Traitement de l\'hypertension', '2007-07-21 00:00:00', NULL, 0.00, 0.00, 0.00),
(6, '390906007', 6, 'Amlodipine 5 mg', 'Actif', '2024-01-10 00:00:00', NULL, NULL, NULL, NULL),
(7, '390906007', 6, 'Metformin 500 mg', 'Actif', '2025-07-18 00:00:00', NULL, NULL, NULL, NULL),
(8, 'RÉSUMÉ DES CONSULTATIONS', 8, 'Amlodipine 5 mg', 'Amlodipine 5 mg', '2013-08-02 00:00:00', NULL, NULL, NULL, NULL),
(9, '390906007', 9, 'Amlodipine 5 mg', 'Traitement en cours pour la hypertension', '2024-07-31 00:00:00', NULL, 0.00, 0.00, 0.00),
(10, '390906007', 12, 'Amlodipine 5 mg', 'Médicament pour la hypertension', '2012-01-30 00:00:00', NULL, 0.00, 0.00, 0.00),
(11, '390906007', 22, 'Amlodipine 5 mg', 'Traitement en cours', '2024-10-10 00:00:00', NULL, 0.00, 0.00, 0.00),
(12, '390906007', 26, 'Amlodipine 5 mg', 'Du 10/10/2020 au En cours', '2020-10-10 00:00:00', NULL, NULL, NULL, NULL),
(13, '390906007', 28, 'Amlodipine 5 mg', 'Traitement de la hypertension', '2009-02-10 00:00:00', NULL, 0.00, 0.00, 0.00),
(14, 'RÉSUMÉ DES CONSULTATIONS', 29, 'Amlodipine 5 mg', 'Traitement pour hypertension', '2021-03-17 00:00:00', NULL, NULL, NULL, NULL),
(15, '390906007', 32, 'Amlodipine 5 mg', 'Du 01/10/2017 au En cours', '2017-01-10 00:00:00', NULL, NULL, NULL, NULL),
(16, '390906007', 33, 'Amlodipine 5 mg', 'Actif', '2025-04-10 00:00:00', NULL, NULL, NULL, NULL),
(17, '390906007', 33, 'Ramipril 5 mg', 'Actif', '2025-08-10 00:00:00', NULL, NULL, NULL, NULL),
(18, 'Visite le 10 mai 2025 à Inconnu', 35, 'Amlodipine 5 mg', 'Du 20/09/2020 au En cours', '2020-09-20 00:00:00', NULL, NULL, NULL, NULL),
(19, '01f0378a-80a5-4dd3-8094-afa971205da1', 36, 'Amlodipine 5 mg', 'Traitement de la hypertension', '2022-12-21 00:00:00', NULL, 0.00, 0.00, 0.00),
(20, '390906007', 38, 'Amlodipine 5 mg', 'Amlodipine 5 mg', '2009-10-17 00:00:00', NULL, NULL, NULL, NULL),
(21, '390906007', 42, 'Losartan 50 mg', 'Médicament pour la hypertension', '2024-08-10 00:00:00', NULL, 0.00, 0.00, 0.00),
(22, '390906007', 45, 'Amlodipine 5 mg', 'Amlodipine 5 mg', '2015-02-09 00:00:00', NULL, NULL, NULL, NULL),
(23, '390906007', 46, 'Amlodipine 5 mg', 'Traitement en cours', '2007-04-18 00:00:00', NULL, 0.00, 0.00, 0.00),
(24, '390906007', 47, 'Bisoprolol 5 mg', 'Traitement en cours', '2024-04-10 00:00:00', NULL, NULL, NULL, NULL),
(25, '390906007', 48, 'Amlodipine 5 mg', 'Traitement en cours', '2020-07-14 00:00:00', NULL, 0.00, 0.00, 0.00),
(26, '390906007', 49, 'Metformin 500 mg', 'Actif', '2024-05-12 00:00:00', NULL, NULL, NULL, NULL),
(27, '390906007', 49, 'Amlodipine 5 mg', 'Actif', '2012-06-08 00:00:00', NULL, NULL, NULL, NULL),
(28, '390906007', 50, 'Amlodipine 5 mg', 'Amlodipine 5 mg', '2014-12-20 00:00:00', NULL, NULL, NULL, NULL),
(29, '390906007', 51, 'Amlodipine 5 mg', 'Traitement en cours', '2025-01-10 00:00:00', NULL, 0.00, 0.00, 0.00),
(30, '390906007', 52, 'Metformin 500 mg', 'Actif', '2024-04-17 00:00:00', NULL, NULL, NULL, NULL),
(31, '390906007', 52, 'Amlodipine 5 mg', 'Actif', '2007-06-24 00:00:00', NULL, NULL, NULL, NULL),
(32, '390906007', 53, 'Amlodipine 5 mg', 'Traitement en cours', '2019-04-16 00:00:00', NULL, 0.00, 0.00, 0.00),
